[I 2025-01-31 20:13:12,952] Trial 5 finished with value: 39.88225231260791 and parameters: {'max_depth': 7, 'learning_rate': 0.010448448856256924, 'min_samples_split': 30}. Best is trial 0 with value: 37.55264877095719.
[I 2025-01-31 20:13:23,051] Trial 6 finished with value: 40.110310178334785 and parameters: {'max_depth': 11, 'learning_rate': 0.00013943589078055564, 'min_samples_split': 29}. Best is trial 0 with value: 37.55264877095719.
[I 2025-01-31 20:13:32,700] Trial 7 finished with value: 41.27527203814309 and parameters: {'max_depth': 19, 'learning_rate': 0.001141639490667389, 'min_samples_split': 44}. Best is trial 0 with value: 37.55264877095719.
[I 2025-01-31 20:13:43,540] Trial 8 finished with value: 42.33260446801089 and parameters: {'max_depth': 15, 'learning_rate': 0.009897902887762227, 'min_samples_split': 20}. Best is trial 0 with value: 37.55264877095719.
[I 2025-01-31 20:13:53,865] Trial 9 finished with value: 43.90611830974721 and parameters: {'max_depth': 12, 'learning_rate': 1.8963438822197395e-05, 'min_samples_split': 26}. Best is trial 0 with value: 37.55264877095719.
[I 2025-01-31 20:14:03,152] Trial 10 finished with value: 44.06376821838944 and parameters: {'max_depth': 3, 'learning_rate': 1.1256425078208696e-05, 'min_samples_split': 47}. Best is trial 0 with value: 37.55264877095719.
[I 2025-01-31 20:14:13,498] Trial 11 finished with value: 50.71128454509485 and parameters: {'max_depth': 6, 'learning_rate': 0.0626981515470716, 'min_samples_split': 38}. Best is trial 0 with value: 37.55264877095719.
[I 2025-01-31 20:14:24,233] Trial 12 finished with value: 47.054542575171766 and parameters: {'max_depth': 7, 'learning_rate': 0.04105565396152607, 'min_samples_split': 20}. Best is trial 0 with value: 37.55264877095719.
[I 2025-01-31 20:14:33,829] Trial 13 finished with value: 44.66819287853954 and parameters: {'max_depth': 3, 'learning_rate': 0.5543468287485395, 'min_samples_split': 38}. Best is trial 0 with value: 37.55264877095719.
[I 2025-01-31 20:14:43,873] Trial 14 finished with value: 36.20780592459284 and parameters: {'max_depth': 14, 'learning_rate': 0.00022003462424304216, 'min_samples_split': 40}. Best is trial 14 with value: 36.20780592459284.
[I 2025-01-31 20:14:53,518] Trial 15 finished with value: 42.9111816853388 and parameters: {'max_depth': 15, 'learning_rate': 0.0001771490119743201, 'min_samples_split': 50}. Best is trial 14 with value: 36.20780592459284.
[I 2025-01-31 20:15:03,039] Trial 16 finished with value: 45.891672174343476 and parameters: {'max_depth': 14, 'learning_rate': 3.875297126752271e-05, 'min_samples_split': 42}. Best is trial 14 with value: 36.20780592459284.
[I 2025-01-31 20:15:13,019] Trial 17 finished with value: 42.55633697368275 and parameters: {'max_depth': 17, 'learning_rate': 0.0005418590658880021, 'min_samples_split': 37}. Best is trial 14 with value: 36.20780592459284.
[I 2025-01-31 20:15:23,360] Trial 18 finished with value: 45.2572513213333 and parameters: {'max_depth': 13, 'learning_rate': 0.00031824729650518674, 'min_samples_split': 22}. Best is trial 14 with value: 36.20780592459284.
[I 2025-01-31 20:15:33,357] Trial 19 finished with value: 38.76706331605461 and parameters: {'max_depth': 9, 'learning_rate': 4.909555694807005e-05, 'min_samples_split': 34}. Best is trial 14 with value: 36.20780592459284.
[I 2025-01-31 20:15:42,946] Trial 20 finished with value: 44.127226674328625 and parameters: {'max_depth': 16, 'learning_rate': 5.076866921196815e-05, 'min_samples_split': 42}. Best is trial 14 with value: 36.20780592459284.
[I 2025-01-31 20:15:52,976] Trial 21 finished with value: 40.97852272893156 and parameters: {'max_depth': 9, 'learning_rate': 5.765310336132277e-05, 'min_samples_split': 34}. Best is trial 14 with value: 36.20780592459284.
[I 2025-01-31 20:16:03,077] Trial 22 finished with value: 44.356988602000975 and parameters: {'max_depth': 10, 'learning_rate': 0.0004470119920179664, 'min_samples_split': 33}. Best is trial 14 with value: 36.20780592459284.
[I 2025-01-31 20:16:13,110] Trial 23 finished with value: 38.72351622914172 and parameters: {'max_depth': 12, 'learning_rate': 2.9105933118142603e-05, 'min_samples_split': 40}. Best is trial 14 with value: 36.20780592459284.
[I 2025-01-31 20:16:22,665] Trial 24 finished with value: 44.89874554689683 and parameters: {'max_depth': 12, 'learning_rate': 1.7872782688961234e-05, 'min_samples_split': 45}. Best is trial 14 with value: 36.20780592459284.
[I 2025-01-31 20:16:32,486] Trial 25 finished with value: 43.72747617279138 and parameters: {'max_depth': 13, 'learning_rate': 0.0001304745396609927, 'min_samples_split': 40}. Best is trial 14 with value: 36.20780592459284.
[I 2025-01-31 20:16:41,830] Trial 26 finished with value: 46.74706319912901 and parameters: {'max_depth': 20, 'learning_rate': 1.0678657591297021e-05, 'min_samples_split': 50}. Best is trial 14 with value: 36.20780592459284.
[I 2025-01-31 20:16:51,409] Trial 27 finished with value: 43.965308444013196 and parameters: {'max_depth': 14, 'learning_rate': 0.0008112055523911153, 'min_samples_split': 46}. Best is trial 14 with value: 36.20780592459284.
[I 2025-01-31 20:17:01,549] Trial 28 finished with value: 38.100607850136285 and parameters: {'max_depth': 16, 'learning_rate': 2.5519035238249135e-05, 'min_samples_split': 27}. Best is trial 14 with value: 36.20780592459284.
[I 2025-01-31 20:17:11,755] Trial 29 finished with value: 40.74772941408074 and parameters: {'max_depth': 17, 'learning_rate': 0.00026892037601358894, 'min_samples_split': 25}. Best is trial 14 with value: 36.20780592459284.
[I 2025-01-31 20:17:23,110] Trial 30 finished with value: 37.14206174441255 and parameters: {'max_depth': 16, 'learning_rate': 0.0022814172233957468, 'min_samples_split': 13}. Best is trial 14 with value: 36.20780592459284.
[I 2025-01-31 20:17:36,438] Trial 31 finished with value: 38.954050042666246 and parameters: {'max_depth': 16, 'learning_rate': 0.006642767508008623, 'min_samples_split': 3}. Best is trial 14 with value: 36.20780592459284.
[I 2025-01-31 20:17:47,510] Trial 32 finished with value: 43.391188496273074 and parameters: {'max_depth': 14, 'learning_rate': 8.798749334538872e-05, 'min_samples_split': 16}. Best is trial 14 with value: 36.20780592459284.
[I 2025-01-31 20:17:59,248] Trial 33 finished with value: 36.74707572545835 and parameters: {'max_depth': 18, 'learning_rate': 0.003634167160431626, 'min_samples_split': 12}. Best is trial 14 with value: 36.20780592459284.
[I 2025-01-31 20:18:10,747] Trial 34 finished with value: 40.433011345204605 and parameters: {'max_depth': 18, 'learning_rate': 0.0023473815775260816, 'min_samples_split': 13}. Best is trial 14 with value: 36.20780592459284.
[I 2025-01-31 20:18:23,006] Trial 35 finished with value: 40.89589981346412 and parameters: {'max_depth': 19, 'learning_rate': 0.004888633676113515, 'min_samples_split': 7}. Best is trial 14 with value: 36.20780592459284.
[I 2025-01-31 20:18:34,876] Trial 36 finished with value: 47.79997011469174 and parameters: {'max_depth': 18, 'learning_rate': 0.019555449975540574, 'min_samples_split': 12}. Best is trial 14 with value: 36.20780592459284.
[I 2025-01-31 20:18:45,994] Trial 37 finished with value: 46.58151657454309 and parameters: {'max_depth': 11, 'learning_rate': 0.0015106590256767649, 'min_samples_split': 16}. Best is trial 14 with value: 36.20780592459284.
[I 2025-01-31 20:18:58,153] Trial 38 finished with value: 46.96837177639626 and parameters: {'max_depth': 17, 'learning_rate': 0.0038858910010501624, 'min_samples_split': 9}. Best is trial 14 with value: 36.20780592459284.
[I 2025-01-31 20:19:10,435] Trial 39 finished with value: 43.552233492106005 and parameters: {'max_depth': 15, 'learning_rate': 0.0007954608132573594, 'min_samples_split': 6}. Best is trial 14 with value: 36.20780592459284.
[I 2025-01-31 20:19:20,538] Trial 40 finished with value: 40.17985742770686 and parameters: {'max_depth': 20, 'learning_rate': 0.0025458220887678005, 'min_samples_split': 31}. Best is trial 14 with value: 36.20780592459284.
[I 2025-01-31 20:19:31,585] Trial 41 finished with value: 41.08631165275148 and parameters: {'max_depth': 16, 'learning_rate': 9.571335294084641e-05, 'min_samples_split': 16}. Best is trial 14 with value: 36.20780592459284.
[I 2025-01-31 20:19:41,886] Trial 42 finished with value: 41.62797980282583 and parameters: {'max_depth': 13, 'learning_rate': 0.01655786806727914, 'min_samples_split': 24}. Best is trial 14 with value: 36.20780592459284.
[I 2025-01-31 20:19:52,226] Trial 43 finished with value: 41.17084560378229 and parameters: {'max_depth': 19, 'learning_rate': 2.2579988712836567e-05, 'min_samples_split': 28}. Best is trial 14 with value: 36.20780592459284.
[I 2025-01-31 20:20:03,119] Trial 44 finished with value: 42.90866434997441 and parameters: {'max_depth': 16, 'learning_rate': 0.0011154571119018396, 'min_samples_split': 19}. Best is trial 14 with value: 36.20780592459284.
[I 2025-01-31 20:20:14,654] Trial 45 finished with value: 36.557781551323785 and parameters: {'max_depth': 18, 'learning_rate': 0.00017648708965358663, 'min_samples_split': 12}. Best is trial 14 with value: 36.20780592459284.
[I 2025-01-31 20:20:26,092] Trial 46 finished with value: 46.226839415669076 and parameters: {'max_depth': 19, 'learning_rate': 0.000202841769863089, 'min_samples_split': 12}. Best is trial 14 with value: 36.20780592459284.
[I 2025-01-31 20:20:37,463] Trial 47 finished with value: 42.84419527513929 and parameters: {'max_depth': 10, 'learning_rate': 0.0004412180285334255, 'min_samples_split': 13}. Best is trial 14 with value: 36.20780592459284.
[I 2025-01-31 20:20:51,370] Trial 48 finished with value: 48.21341645128685 and parameters: {'max_depth': 18, 'learning_rate': 0.15607806680484568, 'min_samples_split': 10}. Best is trial 14 with value: 36.20780592459284.
[I 2025-01-31 20:21:02,743] Trial 49 finished with value: 49.270653884153575 and parameters: {'max_depth': 15, 'learning_rate': 0.035149938407194124, 'min_samples_split': 18}. Best is trial 14 with value: 36.20780592459284.
SHAP summary plot saved to Figs/SHAPsum_RandomForestRegressor_False.png

Predict vs. Reality:
Initialized tuner for GradientBoostingRegressor. Running optimization...
Best parameters for GradientBoostingRegressor: {'max_depth': 14, 'learning_rate': 0.00022003462424304216, 'min_samples_split': 40}
Best MAPE for GradientBoostingRegressor: 36.20780592459284
Results for GradientBoostingRegressor: R2 = -2.5131283497519985, MSE = 1.2402886854419037, MAE = 0.8518281054932539, MAPE = 62.17017720915317%

Bar Plot for Feature Importance:
  0%|          | 0/3 [00:00<?, ?it/s]100%|██████████| 3/3 [00:00<00:00, 235.64it/s]

Generating SHAP Summary Plot...
  0%|          | 0/3 [00:00<?, ?it/s]100%|██████████| 3/3 [00:00<00:00, 228.10it/s]
[I 2025-01-31 20:21:09,834] A new study created in memory with name: no-name-1c7bb886-58ce-4526-8871-0f596d00337c
[I 2025-01-31 20:21:17,499] Trial 0 finished with value: 45.24833678519522 and parameters: {'n_estimators': 352, 'max_depth': 6, 'learning_rate': 0.07457386093106418, 'reg_alpha': 0.0044149027464547895, 'reg_lambda': 3.678387026580175e-05, 'subsample': 0.956316328266549, 'colsample_bytree': 0.6057427695526466, 'gamma': 0.1100634903698322, 'min_child_weight': 8}. Best is trial 0 with value: 45.24833678519522.
[I 2025-01-31 20:21:22,989] Trial 1 finished with value: 44.145079562600365 and parameters: {'n_estimators': 219, 'max_depth': 13, 'learning_rate': 0.03233356832558064, 'reg_alpha': 1.0098948225738677e-05, 'reg_lambda': 2.130407618169116e-05, 'subsample': 0.7022256753356095, 'colsample_bytree': 0.7529772292866505, 'gamma': 2.149511902910019, 'min_child_weight': 2}. Best is trial 1 with value: 44.145079562600365.
[I 2025-01-31 20:21:29,009] Trial 2 finished with value: 40.90473487072616 and parameters: {'n_estimators': 297, 'max_depth': 14, 'learning_rate': 0.05649389189845746, 'reg_alpha': 0.0010522314462902153, 'reg_lambda': 0.00011831260168216481, 'subsample': 0.8242406620482746, 'colsample_bytree': 0.7641378583649255, 'gamma': 3.4685727960514408, 'min_child_weight': 2}. Best is trial 2 with value: 40.90473487072616.
[I 2025-01-31 20:21:34,741] Trial 3 finished with value: 41.662340343039716 and parameters: {'n_estimators': 279, 'max_depth': 7, 'learning_rate': 0.2710619815637435, 'reg_alpha': 0.0012015329080888695, 'reg_lambda': 0.053349376078974345, 'subsample': 0.8814498256341126, 'colsample_bytree': 0.9840194482961584, 'gamma': 2.7981578493330095, 'min_child_weight': 4}. Best is trial 2 with value: 40.90473487072616.
[I 2025-01-31 20:21:40,405] Trial 4 finished with value: 41.391090624066294 and parameters: {'n_estimators': 270, 'max_depth': 15, 'learning_rate': 0.08900045979918163, 'reg_alpha': 0.5387121223271842, 'reg_lambda': 0.0010265894332074277, 'subsample': 0.9434787527686537, 'colsample_bytree': 0.7682834233858964, 'gamma': 4.095315669942572, 'min_child_weight': 4}. Best is trial 2 with value: 40.90473487072616.
[I 2025-01-31 20:21:47,672] Trial 5 finished with value: 39.03424280722964 and parameters: {'n_estimators': 459, 'max_depth': 13, 'learning_rate': 0.029016786964547663, 'reg_alpha': 0.6693231257270907, 'reg_lambda': 0.2391367231965385, 'subsample': 0.7607242378460914, 'colsample_bytree': 0.6064340215758915, 'gamma': 4.210605378254616, 'min_child_weight': 10}. Best is trial 5 with value: 39.03424280722964.
[I 2025-01-31 20:21:52,827] Trial 6 finished with value: 38.31551727627255 and parameters: {'n_estimators': 137, 'max_depth': 11, 'learning_rate': 0.011077344696232175, 'reg_alpha': 0.28437980014121594, 'reg_lambda': 0.04502236953998401, 'subsample': 0.8057264486495435, 'colsample_bytree': 0.6306436799186635, 'gamma': 4.93760668350208, 'min_child_weight': 2}. Best is trial 6 with value: 38.31551727627255.
[I 2025-01-31 20:22:00,005] Trial 7 finished with value: 47.51120074329514 and parameters: {'n_estimators': 432, 'max_depth': 14, 'learning_rate': 0.04626132490307724, 'reg_alpha': 0.005318526985817762, 'reg_lambda': 0.0009000163967182606, 'subsample': 0.7791603757375316, 'colsample_bytree': 0.7202134834445425, 'gamma': 0.26606056510166176, 'min_child_weight': 4}. Best is trial 6 with value: 38.31551727627255.
[I 2025-01-31 20:22:06,332] Trial 8 finished with value: 37.88656490933132 and parameters: {'n_estimators': 342, 'max_depth': 9, 'learning_rate': 0.13877801607474513, 'reg_alpha': 0.0002921449388106112, 'reg_lambda': 0.0038454369791674063, 'subsample': 0.87644944034734, 'colsample_bytree': 0.9255284935564735, 'gamma': 0.36251438564538385, 'min_child_weight': 6}. Best is trial 8 with value: 37.88656490933132.
[I 2025-01-31 20:22:12,643] Trial 9 finished with value: 38.79472894482788 and parameters: {'n_estimators': 286, 'max_depth': 20, 'learning_rate': 0.02286049946590829, 'reg_alpha': 0.2410039673807507, 'reg_lambda': 0.018263694960799156, 'subsample': 0.8053792582063118, 'colsample_bytree': 0.9139049881202713, 'gamma': 1.7990325665384421, 'min_child_weight': 5}. Best is trial 8 with value: 37.88656490933132.
[I 2025-01-31 20:22:19,360] Trial 10 finished with value: 37.95809920734532 and parameters: {'n_estimators': 382, 'max_depth': 3, 'learning_rate': 0.19248709702375932, 'reg_alpha': 3.3805613904012334e-05, 'reg_lambda': 0.004751080244287607, 'subsample': 0.8815857750957221, 'colsample_bytree': 0.8696102231323574, 'gamma': 1.21985057891496, 'min_child_weight': 7}. Best is trial 8 with value: 37.88656490933132.
[I 2025-01-31 20:22:25,993] Trial 11 finished with value: 43.440639102392204 and parameters: {'n_estimators': 381, 'max_depth': 3, 'learning_rate': 0.20080359605471598, 'reg_alpha': 3.424020991411561e-05, 'reg_lambda': 0.004231058100703065, 'subsample': 0.8875218589845262, 'colsample_bytree': 0.8668190995950174, 'gamma': 1.2003638119278317, 'min_child_weight': 7}. Best is trial 8 with value: 37.88656490933132.
[I 2025-01-31 20:22:32,540] Trial 12 finished with value: 45.38552022665418 and parameters: {'n_estimators': 368, 'max_depth': 3, 'learning_rate': 0.1486059991227272, 'reg_alpha': 0.00015456337770096076, 'reg_lambda': 0.004478481502456246, 'subsample': 0.8999343674191824, 'colsample_bytree': 0.8627574638617004, 'gamma': 1.109832438130745, 'min_child_weight': 7}. Best is trial 8 with value: 37.88656490933132.
[I 2025-01-31 20:22:40,005] Trial 13 finished with value: 45.885081764856515 and parameters: {'n_estimators': 490, 'max_depth': 9, 'learning_rate': 0.12894977865858642, 'reg_alpha': 0.00014947799910186422, 'reg_lambda': 0.0005558469259718117, 'subsample': 0.9906534834466357, 'colsample_bytree': 0.9997777095817177, 'gamma': 0.8671787416855731, 'min_child_weight': 9}. Best is trial 8 with value: 37.88656490933132.
[I 2025-01-31 20:22:46,987] Trial 14 finished with value: 40.05998449956124 and parameters: {'n_estimators': 410, 'max_depth': 6, 'learning_rate': 0.26403637983089956, 'reg_alpha': 0.00014902070658381344, 'reg_lambda': 0.6051578152225967, 'subsample': 0.856588216360257, 'colsample_bytree': 0.9138673606382439, 'gamma': 1.6266129411642822, 'min_child_weight': 6}. Best is trial 8 with value: 37.88656490933132.
[I 2025-01-31 20:22:53,344] Trial 15 finished with value: 44.299686646693345 and parameters: {'n_estimators': 336, 'max_depth': 18, 'learning_rate': 0.12064719866467227, 'reg_alpha': 0.032463709452083184, 'reg_lambda': 0.010355263985166651, 'subsample': 0.9151349210565378, 'colsample_bytree': 0.8549155413101037, 'gamma': 0.5819619649084916, 'min_child_weight': 6}. Best is trial 8 with value: 37.88656490933132.
[I 2025-01-31 20:22:58,931] Trial 16 finished with value: 37.81245845182344 and parameters: {'n_estimators': 234, 'max_depth': 9, 'learning_rate': 0.20485891334887363, 'reg_alpha': 3.300348460786662e-05, 'reg_lambda': 0.0002046267310787393, 'subsample': 0.8340725439796275, 'colsample_bytree': 0.9289938770387536, 'gamma': 2.5788719641855016, 'min_child_weight': 9}. Best is trial 16 with value: 37.81245845182344.
[I 2025-01-31 20:23:04,348] Trial 17 finished with value: 43.18005488086682 and parameters: {'n_estimators': 215, 'max_depth': 9, 'learning_rate': 0.0928549029459732, 'reg_alpha': 0.0007339231376163032, 'reg_lambda': 0.00014822380981298705, 'subsample': 0.8493677744118984, 'colsample_bytree': 0.9198912912233856, 'gamma': 2.7731156828963046, 'min_child_weight': 10}. Best is trial 16 with value: 37.81245845182344.
[I 2025-01-31 20:23:09,109] Trial 18 finished with value: 41.11328243763782 and parameters: {'n_estimators': 125, 'max_depth': 10, 'learning_rate': 0.17802267527431825, 'reg_alpha': 1.4346480341533238e-05, 'reg_lambda': 0.0002494144804051407, 'subsample': 0.729230764613362, 'colsample_bytree': 0.951430605357044, 'gamma': 3.23642245180392, 'min_child_weight': 9}. Best is trial 16 with value: 37.81245845182344.
[I 2025-01-31 20:23:14,570] Trial 19 finished with value: 41.6897735153303 and parameters: {'n_estimators': 212, 'max_depth': 8, 'learning_rate': 0.11479693817032575, 'reg_alpha': 0.0003517303763280034, 'reg_lambda': 6.95002302593742e-05, 'subsample': 0.8442161495587136, 'colsample_bytree': 0.8057266270263764, 'gamma': 2.090436407638435, 'min_child_weight': 8}. Best is trial 16 with value: 37.81245845182344.
[I 2025-01-31 20:23:19,683] Trial 20 finished with value: 48.503401955655654 and parameters: {'n_estimators': 172, 'max_depth': 16, 'learning_rate': 0.06275345326848898, 'reg_alpha': 5.0768165722178594e-05, 'reg_lambda': 1.0301097890351575e-05, 'subsample': 0.931733615470553, 'colsample_bytree': 0.818600413351394, 'gamma': 3.3791533473465982, 'min_child_weight': 1}. Best is trial 16 with value: 37.81245845182344.
[I 2025-01-31 20:23:25,879] Trial 21 finished with value: 42.423534124117666 and parameters: {'n_estimators': 324, 'max_depth': 5, 'learning_rate': 0.2085004619036948, 'reg_alpha': 4.876799212060766e-05, 'reg_lambda': 0.002238016427839422, 'subsample': 0.8636611651090029, 'colsample_bytree': 0.9510565204725475, 'gamma': 1.3925914315664079, 'min_child_weight': 7}. Best is trial 16 with value: 37.81245845182344.
[I 2025-01-31 20:23:31,558] Trial 22 finished with value: 45.51887761011963 and parameters: {'n_estimators': 255, 'max_depth': 4, 'learning_rate': 0.271663570371646, 'reg_alpha': 3.404075898964099e-05, 'reg_lambda': 0.012756059327056125, 'subsample': 0.8198220945519656, 'colsample_bytree': 0.8909070343237551, 'gamma': 0.553952173731665, 'min_child_weight': 8}. Best is trial 16 with value: 37.81245845182344.
[I 2025-01-31 20:23:38,615] Trial 23 finished with value: 41.36096677361934 and parameters: {'n_estimators': 406, 'max_depth': 11, 'learning_rate': 0.1534021794085291, 'reg_alpha': 0.00032254414194840547, 'reg_lambda': 0.00037523666341061267, 'subsample': 0.8743862032941728, 'colsample_bytree': 0.9521629653848317, 'gamma': 0.808106451103539, 'min_child_weight': 5}. Best is trial 16 with value: 37.81245845182344.
[I 2025-01-31 20:23:44,802] Trial 24 finished with value: 42.12790654003416 and parameters: {'n_estimators': 318, 'max_depth': 8, 'learning_rate': 0.2064625939002808, 'reg_alpha': 8.950540809993872e-05, 'reg_lambda': 0.0021681716487110085, 'subsample': 0.9151353331945912, 'colsample_bytree': 0.8415558932249128, 'gamma': 2.309634563290661, 'min_child_weight': 9}. Best is trial 16 with value: 37.81245845182344.
[I 2025-01-31 20:23:50,493] Trial 25 finished with value: 44.46311826632755 and parameters: {'n_estimators': 251, 'max_depth': 5, 'learning_rate': 0.09260921305711922, 'reg_alpha': 1.8847942017598568e-05, 'reg_lambda': 0.041558864298287305, 'subsample': 0.7807708633957491, 'colsample_bytree': 0.8973187360388172, 'gamma': 2.648650430227191, 'min_child_weight': 6}. Best is trial 16 with value: 37.81245845182344.
