[I 2025-01-31 19:22:49,143] Trial 34 finished with value: 37.520810429610236 and parameters: {'activation': 'tanh', 'alpha': 0.0008103756906481242, 'learning_rate_init': 0.0001027444979945838, 'max_iter': 899809}. Best is trial 24 with value: 34.842098100589666.
[I 2025-01-31 19:22:55,613] Trial 35 finished with value: 38.32648492213005 and parameters: {'activation': 'tanh', 'alpha': 0.07128509453179907, 'learning_rate_init': 0.019918340491866283, 'max_iter': 734554}. Best is trial 24 with value: 34.842098100589666.
[I 2025-01-31 19:23:29,219] Trial 36 finished with value: 37.56399580359918 and parameters: {'activation': 'tanh', 'alpha': 0.00011031564839740573, 'learning_rate_init': 0.00016687682007935929, 'max_iter': 220344}. Best is trial 24 with value: 34.842098100589666.
[I 2025-01-31 19:23:44,607] Trial 37 finished with value: 34.041554734780426 and parameters: {'activation': 'tanh', 'alpha': 0.025891074187257584, 'learning_rate_init': 0.0005145831449675972, 'max_iter': 659692}. Best is trial 37 with value: 34.041554734780426.
[I 2025-01-31 19:23:54,490] Trial 38 finished with value: 38.30696053558228 and parameters: {'activation': 'tanh', 'alpha': 0.03758305979516169, 'learning_rate_init': 0.0010182988927760228, 'max_iter': 658786}. Best is trial 37 with value: 34.041554734780426.
[I 2025-01-31 19:24:10,746] Trial 39 finished with value: 38.973694755554796 and parameters: {'activation': 'tanh', 'alpha': 0.020271769452143255, 'learning_rate_init': 0.0004676440791307834, 'max_iter': 486937}. Best is trial 37 with value: 34.041554734780426.
[I 2025-01-31 19:24:16,743] Trial 40 finished with value: 49.20675223684593 and parameters: {'activation': 'logistic', 'alpha': 0.008957575929668596, 'learning_rate_init': 0.005204866680450581, 'max_iter': 539624}. Best is trial 37 with value: 34.041554734780426.
[I 2025-01-31 19:24:36,695] Trial 41 finished with value: 38.543491934509476 and parameters: {'activation': 'tanh', 'alpha': 0.02530738795984008, 'learning_rate_init': 0.0003335580979810227, 'max_iter': 946177}. Best is trial 37 with value: 34.041554734780426.
[I 2025-01-31 19:24:49,421] Trial 42 finished with value: 41.47678811192941 and parameters: {'activation': 'tanh', 'alpha': 0.09664489514716604, 'learning_rate_init': 0.0006788939872133244, 'max_iter': 838686}. Best is trial 37 with value: 34.041554734780426.
[I 2025-01-31 19:25:05,379] Trial 43 finished with value: 34.93649606263358 and parameters: {'activation': 'tanh', 'alpha': 0.005291174168125234, 'learning_rate_init': 0.000484894156267642, 'max_iter': 788107}. Best is trial 37 with value: 34.041554734780426.
[I 2025-01-31 19:25:13,998] Trial 44 finished with value: 41.63407345706293 and parameters: {'activation': 'tanh', 'alpha': 0.014156377604317994, 'learning_rate_init': 0.0014821083140794853, 'max_iter': 671390}. Best is trial 37 with value: 34.041554734780426.
[I 2025-01-31 19:25:30,370] Trial 45 finished with value: 42.05140857688099 and parameters: {'activation': 'tanh', 'alpha': 0.00516511577722584, 'learning_rate_init': 0.0004595758629623419, 'max_iter': 614715}. Best is trial 37 with value: 34.041554734780426.
[I 2025-01-31 19:25:41,441] Trial 46 finished with value: 39.15863415961648 and parameters: {'activation': 'tanh', 'alpha': 0.05988794311232626, 'learning_rate_init': 0.0008648804020798237, 'max_iter': 776921}. Best is trial 37 with value: 34.041554734780426.
[I 2025-01-31 19:25:50,243] Trial 47 finished with value: 82.25713779012892 and parameters: {'activation': 'relu', 'alpha': 0.02858181922345459, 'learning_rate_init': 0.0021951809602193634, 'max_iter': 798847}. Best is trial 37 with value: 34.041554734780426.
[I 2025-01-31 19:26:13,190] Trial 48 finished with value: 37.98827486960664 and parameters: {'activation': 'tanh', 'alpha': 0.01106416145339269, 'learning_rate_init': 0.00027883268879677994, 'max_iter': 717006}. Best is trial 37 with value: 34.041554734780426.
[I 2025-01-31 19:26:42,525] Trial 49 finished with value: 38.624668105507446 and parameters: {'activation': 'logistic', 'alpha': 0.04444441308452753, 'learning_rate_init': 0.0004796095352936252, 'max_iter': 645800}. Best is trial 37 with value: 34.041554734780426.
SHAP summary plot saved to Figs/SHAPsum_SVR_False.png

Predict vs. Reality:
Initialized tuner for MLPRegressor. Running optimization...
Best parameters for MLPRegressor: {'activation': 'tanh', 'alpha': 0.025891074187257584, 'learning_rate_init': 0.0005145831449675972, 'max_iter': 659692}
Best MAPE for MLPRegressor: 34.041554734780426
Results for MLPRegressor: R2 = -1.4255242343863315, MSE = 0.8216207099070149, MAE = 0.6160008910333724, MAPE = 60.60550113357665%

Bar Plot for Feature Importance:
  0%|          | 0/3 [00:00<?, ?it/s]100%|██████████| 3/3 [00:00<00:00, 197.29it/s]

Generating SHAP Summary Plot...
  0%|          | 0/3 [00:00<?, ?it/s]100%|██████████| 3/3 [00:00<00:00, 260.68it/s]
[I 2025-01-31 19:26:50,289] A new study created in memory with name: no-name-5caeef4c-2819-45b9-9c9b-e4e6cf719e98
[I 2025-01-31 19:26:53,605] Trial 0 finished with value: 61.81416522028594 and parameters: {'alpha_1': 0.005780645272952004, 'alpha_2': 0.003599837381865983, 'lambda_1': 0.0009017760814354214, 'lambda_2': 0.1035392832752338}. Best is trial 0 with value: 61.81416522028594.
[I 2025-01-31 19:26:56,862] Trial 1 finished with value: 54.94808957727771 and parameters: {'alpha_1': 1.650524891108492e-05, 'alpha_2': 0.01650141849641288, 'lambda_1': 1.5771297549247586e-05, 'lambda_2': 2.1460489140871563e-05}. Best is trial 1 with value: 54.94808957727771.
[I 2025-01-31 19:27:00,099] Trial 2 finished with value: 57.87746032378276 and parameters: {'alpha_1': 0.00011443454059979625, 'alpha_2': 0.23281345800992506, 'lambda_1': 0.007333120319303082, 'lambda_2': 0.44014518458259494}. Best is trial 1 with value: 54.94808957727771.
[I 2025-01-31 19:27:03,260] Trial 3 finished with value: 53.75710727414898 and parameters: {'alpha_1': 0.09488125767106972, 'alpha_2': 1.1022851126044268e-05, 'lambda_1': 0.00010784582731963273, 'lambda_2': 1.4051785119737598e-05}. Best is trial 3 with value: 53.75710727414898.
[I 2025-01-31 19:27:06,512] Trial 4 finished with value: 58.847688138177176 and parameters: {'alpha_1': 0.05463620885460159, 'alpha_2': 3.0461279311833216e-05, 'lambda_1': 0.13428377500101704, 'lambda_2': 0.05982577418569523}. Best is trial 3 with value: 53.75710727414898.
[I 2025-01-31 19:27:09,723] Trial 5 finished with value: 57.6737628010647 and parameters: {'alpha_1': 2.2705443672841278e-05, 'alpha_2': 0.091437346268396, 'lambda_1': 0.0019720570568424684, 'lambda_2': 0.008165071782511267}. Best is trial 3 with value: 53.75710727414898.
[I 2025-01-31 19:27:12,944] Trial 6 finished with value: 60.44199870621154 and parameters: {'alpha_1': 6.226275631632095e-05, 'alpha_2': 1.4809898131037853e-05, 'lambda_1': 0.25224907757678633, 'lambda_2': 0.04851384608234326}. Best is trial 3 with value: 53.75710727414898.
[I 2025-01-31 19:27:16,155] Trial 7 finished with value: 55.073493698430454 and parameters: {'alpha_1': 2.6417712997458527e-05, 'alpha_2': 0.006872563171015732, 'lambda_1': 0.7123107492563584, 'lambda_2': 0.011827596129612303}. Best is trial 3 with value: 53.75710727414898.
[I 2025-01-31 19:27:19,333] Trial 8 finished with value: 60.69221477784111 and parameters: {'alpha_1': 0.06880434368588242, 'alpha_2': 0.03109657945888138, 'lambda_1': 9.144891425773944e-05, 'lambda_2': 0.012695408482379784}. Best is trial 3 with value: 53.75710727414898.
[I 2025-01-31 19:27:22,542] Trial 9 finished with value: 52.45523039839638 and parameters: {'alpha_1': 0.001183949416758923, 'alpha_2': 0.005327172463611767, 'lambda_1': 9.951861725062978e-05, 'lambda_2': 0.17813608348031393}. Best is trial 9 with value: 52.45523039839638.
[I 2025-01-31 19:27:25,797] Trial 10 finished with value: 63.83029261012631 and parameters: {'alpha_1': 0.0013530620761572608, 'alpha_2': 0.0003903020098251679, 'lambda_1': 0.019340987708320916, 'lambda_2': 0.0004532281290019244}. Best is trial 9 with value: 52.45523039839638.
[I 2025-01-31 19:27:29,020] Trial 11 finished with value: 53.43833335602083 and parameters: {'alpha_1': 0.8395826907472271, 'alpha_2': 0.0006254973429327318, 'lambda_1': 0.00015062435320750326, 'lambda_2': 0.0003474593242448573}. Best is trial 9 with value: 52.45523039839638.
[I 2025-01-31 19:27:32,226] Trial 12 finished with value: 60.684900651796276 and parameters: {'alpha_1': 0.6316065997881213, 'alpha_2': 0.0005585723802281009, 'lambda_1': 0.0002194848842597153, 'lambda_2': 0.00042712968141475925}. Best is trial 9 with value: 52.45523039839638.
[I 2025-01-31 19:27:35,398] Trial 13 finished with value: 63.66361656534279 and parameters: {'alpha_1': 0.001024063665417358, 'alpha_2': 0.00045995451194136896, 'lambda_1': 1.6111665754361188e-05, 'lambda_2': 0.0003024631473854186}. Best is trial 9 with value: 52.45523039839638.
[I 2025-01-31 19:27:38,608] Trial 14 finished with value: 64.28435765386688 and parameters: {'alpha_1': 0.005609937477934309, 'alpha_2': 0.00012775081583104247, 'lambda_1': 0.0002584586162584137, 'lambda_2': 0.9317765520291601}. Best is trial 9 with value: 52.45523039839638.
[I 2025-01-31 19:27:41,786] Trial 15 finished with value: 54.60064947782385 and parameters: {'alpha_1': 0.0002927205669465981, 'alpha_2': 0.8104790417815376, 'lambda_1': 3.9931026873879045e-05, 'lambda_2': 0.0018118687599118183}. Best is trial 9 with value: 52.45523039839638.
[I 2025-01-31 19:27:44,928] Trial 16 finished with value: 57.46230457165299 and parameters: {'alpha_1': 0.017834835080024983, 'alpha_2': 0.00134917333231114, 'lambda_1': 0.000561104794525513, 'lambda_2': 6.063044968551983e-05}. Best is trial 9 with value: 52.45523039839638.
[I 2025-01-31 19:27:48,160] Trial 17 finished with value: 58.68854070367914 and parameters: {'alpha_1': 0.7687642181998185, 'alpha_2': 6.436506106680076e-05, 'lambda_1': 0.004626110195000435, 'lambda_2': 0.0018740089496259039}. Best is trial 9 with value: 52.45523039839638.
[I 2025-01-31 19:27:51,455] Trial 18 finished with value: 66.9983034183569 and parameters: {'alpha_1': 0.0002734874720266168, 'alpha_2': 0.0013950628495754387, 'lambda_1': 4.578714178327551e-05, 'lambda_2': 0.00010545457755571712}. Best is trial 9 with value: 52.45523039839638.
[I 2025-01-31 19:27:54,672] Trial 19 finished with value: 57.94147545441793 and parameters: {'alpha_1': 0.24088594699908797, 'alpha_2': 0.01676567012254653, 'lambda_1': 0.021540605963695086, 'lambda_2': 0.003973168773367941}. Best is trial 9 with value: 52.45523039839638.
[I 2025-01-31 19:27:57,907] Trial 20 finished with value: 56.353628932875644 and parameters: {'alpha_1': 0.001484789417869432, 'alpha_2': 0.0001955309794084072, 'lambda_1': 0.0010114022179954264, 'lambda_2': 0.16648167686478585}. Best is trial 9 with value: 52.45523039839638.
[I 2025-01-31 19:28:01,064] Trial 21 finished with value: 59.5429086478512 and parameters: {'alpha_1': 0.16212700273316172, 'alpha_2': 0.002127160863284201, 'lambda_1': 0.0001185708347575815, 'lambda_2': 1.743600835401779e-05}. Best is trial 9 with value: 52.45523039839638.
[I 2025-01-31 19:28:04,290] Trial 22 finished with value: 59.75839148327362 and parameters: {'alpha_1': 0.02040117029394608, 'alpha_2': 1.4398540589341637e-05, 'lambda_1': 0.00035027407472883686, 'lambda_2': 8.942780343675728e-05}. Best is trial 9 with value: 52.45523039839638.
[I 2025-01-31 19:28:07,488] Trial 23 finished with value: 58.300763898643396 and parameters: {'alpha_1': 0.9586579957146601, 'alpha_2': 0.006380703818951156, 'lambda_1': 5.833322772185184e-05, 'lambda_2': 1.0859418026538981e-05}. Best is trial 9 with value: 52.45523039839638.
[I 2025-01-31 19:28:10,650] Trial 24 finished with value: 61.90927387926655 and parameters: {'alpha_1': 0.2962321775777957, 'alpha_2': 6.569727205566633e-05, 'lambda_1': 1.3310656225985045e-05, 'lambda_2': 3.874331380271174e-05}. Best is trial 9 with value: 52.45523039839638.
[I 2025-01-31 19:28:13,880] Trial 25 finished with value: 63.88571867841005 and parameters: {'alpha_1': 0.05130102355902532, 'alpha_2': 0.057139975383547766, 'lambda_1': 0.0001562961333591859, 'lambda_2': 0.00016703552824835245}. Best is trial 9 with value: 52.45523039839638.
[I 2025-01-31 19:28:17,134] Trial 26 finished with value: 48.74988171674252 and parameters: {'alpha_1': 0.015974189446477983, 'alpha_2': 0.0007012015608170734, 'lambda_1': 2.6321636172402383e-05, 'lambda_2': 0.0010268417838371693}. Best is trial 26 with value: 48.74988171674252.
[I 2025-01-31 19:28:20,382] Trial 27 finished with value: 57.59852626100461 and parameters: {'alpha_1': 0.018138498402480854, 'alpha_2': 0.0009727157457750335, 'lambda_1': 3.781073264121759e-05, 'lambda_2': 0.0009465527427075914}. Best is trial 26 with value: 48.74988171674252.
[I 2025-01-31 19:28:23,622] Trial 28 finished with value: 56.99044085463617 and parameters: {'alpha_1': 0.0005169090484999882, 'alpha_2': 0.0040353230279368164, 'lambda_1': 0.0020910470932373197, 'lambda_2': 0.004503331200499093}. Best is trial 26 with value: 48.74988171674252.
[I 2025-01-31 19:28:26,869] Trial 29 finished with value: 63.46074079033904 and parameters: {'alpha_1': 0.004767748792860276, 'alpha_2': 0.00019830483937355818, 'lambda_1': 0.0010689783697171772, 'lambda_2': 0.0007807022264669472}. Best is trial 26 with value: 48.74988171674252.
[I 2025-01-31 19:28:30,230] Trial 30 finished with value: 53.5973911635451 and parameters: {'alpha_1': 0.012527979395964613, 'alpha_2': 0.003723163214175586, 'lambda_1': 2.6795367504735428e-05, 'lambda_2': 0.027849252704704053}. Best is trial 26 with value: 48.74988171674252.
[I 2025-01-31 19:28:33,492] Trial 31 finished with value: 58.57544289934864 and parameters: {'alpha_1': 0.011046749339063763, 'alpha_2': 0.0034151735235560497, 'lambda_1': 3.2387206140506005e-05, 'lambda_2': 0.02421605549770088}. Best is trial 26 with value: 48.74988171674252.
[I 2025-01-31 19:28:36,735] Trial 32 finished with value: 56.03804191447281 and parameters: {'alpha_1': 0.003805192609935781, 'alpha_2': 0.010879615780919174, 'lambda_1': 2.011830672806577e-05, 'lambda_2': 0.28348949971053855}. Best is trial 26 with value: 48.74988171674252.
[I 2025-01-31 19:28:40,018] Trial 33 finished with value: 59.28392948042911 and parameters: {'alpha_1': 0.002437888285875801, 'alpha_2': 0.0024069393694818894, 'lambda_1': 1.1127235517089582e-05, 'lambda_2': 0.0706227332936147}. Best is trial 26 with value: 48.74988171674252.
[I 2025-01-31 19:28:43,251] Trial 34 finished with value: 61.15132749927083 and parameters: {'alpha_1': 0.03164930235225382, 'alpha_2': 0.0008283534631056415, 'lambda_1': 6.863577970065587e-05, 'lambda_2': 0.02426814177148903}. Best is trial 26 with value: 48.74988171674252.
[I 2025-01-31 19:28:46,417] Trial 35 finished with value: 59.2554580528318 and parameters: {'alpha_1': 0.010074296013571397, 'alpha_2': 0.02648543106556101, 'lambda_1': 0.0004596381942362394, 'lambda_2': 0.6083337212896658}. Best is trial 26 with value: 48.74988171674252.
[I 2025-01-31 19:28:49,662] Trial 36 finished with value: 59.08348798847332 and parameters: {'alpha_1': 0.0005833663570703482, 'alpha_2': 0.0002938395459692267, 'lambda_1': 2.367922596614286e-05, 'lambda_2': 0.03166166948504975}. Best is trial 26 with value: 48.74988171674252.
[I 2025-01-31 19:28:52,873] Trial 37 finished with value: 52.57309365561368 and parameters: {'alpha_1': 0.0025194849073343845, 'alpha_2': 0.005708433491398988, 'lambda_1': 0.00015996037575611942, 'lambda_2': 0.16497348501573517}. Best is trial 26 with value: 48.74988171674252.
[I 2025-01-31 19:28:56,112] Trial 38 finished with value: 56.10823573760554 and parameters: {'alpha_1': 0.0026132448000422887, 'alpha_2': 0.00778971123020116, 'lambda_1': 0.00016543655068342804, 'lambda_2': 0.17114042068143942}. Best is trial 26 with value: 48.74988171674252.
[I 2025-01-31 19:28:59,301] Trial 39 finished with value: 62.50126390114342 and parameters: {'alpha_1': 0.0001909028185596057, 'alpha_2': 0.08703152022594594, 'lambda_1': 7.00883556936245e-05, 'lambda_2': 0.11886368071948648}. Best is trial 26 with value: 48.74988171674252.
[I 2025-01-31 19:29:02,458] Trial 40 finished with value: 62.84429902771008 and parameters: {'alpha_1': 0.0006509134782899147, 'alpha_2': 0.0167911617837988, 'lambda_1': 9.974195126012847e-05, 'lambda_2': 0.3693573688860049}. Best is trial 26 with value: 48.74988171674252.
[I 2025-01-31 19:29:05,730] Trial 41 finished with value: 55.52862547345268 and parameters: {'alpha_1': 0.009972782384925657, 'alpha_2': 0.004991596491222642, 'lambda_1': 2.308378478507572e-05, 'lambda_2': 0.08449165699684057}. Best is trial 26 with value: 48.74988171674252.
[I 2025-01-31 19:29:08,894] Trial 42 finished with value: 53.43217858946547 and parameters: {'alpha_1': 8.945782555184636e-05, 'alpha_2': 0.0024911008890334597, 'lambda_1': 0.0006458707275008642, 'lambda_2': 0.009025536295349116}. Best is trial 26 with value: 48.74988171674252.
[I 2025-01-31 19:29:12,098] Trial 43 finished with value: 62.13339203226122 and parameters: {'alpha_1': 1.187269426205223e-05, 'alpha_2': 0.00205933704116018, 'lambda_1': 0.000447535827323702, 'lambda_2': 0.01006453191765543}. Best is trial 26 with value: 48.74988171674252.
[I 2025-01-31 19:29:15,293] Trial 44 finished with value: 64.59375905028561 and parameters: {'alpha_1': 9.080354980879804e-05, 'alpha_2': 0.0006903565698988564, 'lambda_1': 0.0006713098104583742, 'lambda_2': 0.0002476805726505539}. Best is trial 26 with value: 48.74988171674252.
[I 2025-01-31 19:29:18,523] Trial 45 finished with value: 55.11264233146037 and parameters: {'alpha_1': 3.5944703725510116e-05, 'alpha_2': 0.001351853699737377, 'lambda_1': 0.0016179042942335601, 'lambda_2': 0.0010938957354747635}. Best is trial 26 with value: 48.74988171674252.
[I 2025-01-31 19:29:21,718] Trial 46 finished with value: 59.715919705615995 and parameters: {'alpha_1': 5.106029308460886e-05, 'alpha_2': 0.011453676694356806, 'lambda_1': 0.0001652090199917884, 'lambda_2': 0.002928285287820067}. Best is trial 26 with value: 48.74988171674252.
[I 2025-01-31 19:29:24,912] Trial 47 finished with value: 62.79339056417626 and parameters: {'alpha_1': 0.00011906450751287156, 'alpha_2': 8.712840247115251e-05, 'lambda_1': 0.0002753956119592055, 'lambda_2': 0.006180062759584181}. Best is trial 26 with value: 48.74988171674252.
[I 2025-01-31 19:29:28,071] Trial 48 finished with value: 58.31243197241416 and parameters: {'alpha_1': 0.001720616485002952, 'alpha_2': 0.0003914641456921618, 'lambda_1': 0.012552157001427247, 'lambda_2': 0.0005638795437491108}. Best is trial 26 with value: 48.74988171674252.
[I 2025-01-31 19:29:31,469] Trial 49 finished with value: 67.49198892838145 and parameters: {'alpha_1': 0.0008635977579529441, 'alpha_2': 3.0436294361690396e-05, 'lambda_1': 0.003992063178904199, 'lambda_2': 0.0020581046447596505}. Best is trial 26 with value: 48.74988171674252.
SHAP summary plot saved to Figs/SHAPsum_MLPRegressor_False.png

Predict vs. Reality:
Initialized tuner for BayesianRidge. Running optimization...
Best parameters for BayesianRidge: {'alpha_1': 0.015974189446477983, 'alpha_2': 0.0007012015608170734, 'lambda_1': 2.6321636172402383e-05, 'lambda_2': 0.0010268417838371693}
Best MAPE for BayesianRidge: 48.74988171674252
Results for BayesianRidge: R2 = -2.240049210505399, MSE = 1.0807411774926972, MAE = 0.6852507856637153, MAPE = 77.20310393228753%

Bar Plot for Feature Importance:
  0%|          | 0/3 [00:00<?, ?it/s]100%|██████████| 3/3 [00:00<00:00, 287.24it/s]

Generating SHAP Summary Plot...
  0%|          | 0/3 [00:00<?, ?it/s]100%|██████████| 3/3 [00:00<00:00, 276.94it/s]
[I 2025-01-31 19:29:37,827] A new study created in memory with name: no-name-79ade3e0-d8b7-49ef-9207-a974b0b31f3d
[I 2025-01-31 19:29:41,064] Trial 0 finished with value: 39.30205103617919 and parameters: {'alpha': 1.2990945736092423, 'l1_ratio': 0.30583056923558, 'max_iter': 6140380}. Best is trial 0 with value: 39.30205103617919.
[I 2025-01-31 19:29:44,209] Trial 1 finished with value: 43.92526874003062 and parameters: {'alpha': 0.4840226346226472, 'l1_ratio': 0.7046037679760728, 'max_iter': 2743064}. Best is trial 0 with value: 39.30205103617919.
[I 2025-01-31 19:29:47,380] Trial 2 finished with value: 38.80350103061673 and parameters: {'alpha': 65.91246133379447, 'l1_ratio': 0.9051824962766356, 'max_iter': 4129297}. Best is trial 2 with value: 38.80350103061673.
[I 2025-01-31 19:29:50,695] Trial 3 finished with value: 60.212527699258544 and parameters: {'alpha': 8.219789838885352e-05, 'l1_ratio': 0.4608728318671199, 'max_iter': 582730}. Best is trial 2 with value: 38.80350103061673.
[I 2025-01-31 19:29:53,831] Trial 4 finished with value: 38.92091668227293 and parameters: {'alpha': 0.008552490118211901, 'l1_ratio': 0.862792302275366, 'max_iter': 1256565}. Best is trial 2 with value: 38.80350103061673.
[I 2025-01-31 19:29:56,964] Trial 5 finished with value: 46.42362346336751 and parameters: {'alpha': 0.6857385986012479, 'l1_ratio': 0.8396163081154046, 'max_iter': 8525775}. Best is trial 2 with value: 38.80350103061673.
[I 2025-01-31 19:30:00,175] Trial 6 finished with value: 58.66464467328709 and parameters: {'alpha': 0.00015221614975713838, 'l1_ratio': 0.5809672750852737, 'max_iter': 3472445}. Best is trial 2 with value: 38.80350103061673.
[I 2025-01-31 19:30:03,398] Trial 7 finished with value: 51.93776292356269 and parameters: {'alpha': 0.0007630515962755141, 'l1_ratio': 0.7978336227453297, 'max_iter': 9575197}. Best is trial 2 with value: 38.80350103061673.
[I 2025-01-31 19:30:06,605] Trial 8 finished with value: 39.570581448044464 and parameters: {'alpha': 7.899746437888339, 'l1_ratio': 0.41786995211486433, 'max_iter': 4097525}. Best is trial 2 with value: 38.80350103061673.
[I 2025-01-31 19:30:09,726] Trial 9 finished with value: 29.28647292631998 and parameters: {'alpha': 0.15274266941999942, 'l1_ratio': 0.5789392188701508, 'max_iter': 9193046}. Best is trial 9 with value: 29.28647292631998.
