[I 2025-01-31 19:08:39,258] A new study created in memory with name: no-name-518505df-5128-418a-9040-3a0126840855
Arguments: Namespace(file_path='ex.txt', models=['SVR', 'MLPRegressor', 'BayesianRidge', 'ElasticNet', 'RandomForestRegressor', 'GradientBoostingRegressor', 'XGBRegressor'], num_samples=20, noise_level_X=0.01, noise_level_y=0.01, num_trials=50, num_iterations=100)
Loading data...
Selected models: ['SVR', 'MLPRegressor', 'BayesianRidge', 'ElasticNet', 'RandomForestRegressor', 'GradientBoostingRegressor', 'XGBRegressor']
Initialized tuner for SVR. Running optimization...
[I 2025-01-31 19:08:46,505] Trial 0 finished with value: 48.40601253236189 and parameters: {'C': 4.933475492259422, 'epsilon': 0.8725322774178681, 'kernel': 'sigmoid', 'gamma': 'auto'}. Best is trial 0 with value: 48.40601253236189.
[I 2025-01-31 19:08:49,837] Trial 1 finished with value: 183.24740985573976 and parameters: {'C': 5.877939156874809, 'epsilon': 0.3235366886085349, 'kernel': 'sigmoid', 'gamma': 'scale'}. Best is trial 0 with value: 48.40601253236189.
[I 2025-01-31 19:08:53,040] Trial 2 finished with value: 63.81985354414834 and parameters: {'C': 92.38157105178676, 'epsilon': 0.5513545110207974, 'kernel': 'poly', 'degree': 4, 'gamma': 'auto'}. Best is trial 0 with value: 48.40601253236189.
[I 2025-01-31 19:08:56,254] Trial 3 finished with value: 62.69495035194237 and parameters: {'C': 15.741194005082535, 'epsilon': 0.7686980259031934, 'kernel': 'poly', 'degree': 2, 'gamma': 'scale'}. Best is trial 0 with value: 48.40601253236189.
[I 2025-01-31 19:08:59,656] Trial 4 finished with value: 47.046761610661655 and parameters: {'C': 327.2334958587962, 'epsilon': 0.47911729385532925, 'kernel': 'linear', 'gamma': 'scale'}. Best is trial 4 with value: 47.046761610661655.
[I 2025-01-31 19:09:02,966] Trial 5 finished with value: 74.98847871369831 and parameters: {'C': 1.4198213017017915, 'epsilon': 0.8416923526390365, 'kernel': 'poly', 'degree': 5, 'gamma': 'scale'}. Best is trial 4 with value: 47.046761610661655.
[I 2025-01-31 19:09:06,151] Trial 6 finished with value: 42.489951952203356 and parameters: {'C': 5.54708382802702, 'epsilon': 0.9142337142007217, 'kernel': 'linear', 'gamma': 'auto'}. Best is trial 6 with value: 42.489951952203356.
[I 2025-01-31 19:09:09,379] Trial 7 finished with value: 48.92046513022085 and parameters: {'C': 34.20552276035084, 'epsilon': 0.7460543201139498, 'kernel': 'poly', 'degree': 3, 'gamma': 'scale'}. Best is trial 6 with value: 42.489951952203356.
[I 2025-01-31 19:09:12,567] Trial 8 finished with value: 50.62380229741747 and parameters: {'C': 19.884658886014677, 'epsilon': 0.6068128229777685, 'kernel': 'rbf', 'gamma': 'scale'}. Best is trial 6 with value: 42.489951952203356.
[I 2025-01-31 19:09:15,951] Trial 9 finished with value: 45.93066032144283 and parameters: {'C': 0.20584416521464105, 'epsilon': 0.6416093630696653, 'kernel': 'rbf', 'gamma': 'auto'}. Best is trial 6 with value: 42.489951952203356.
[I 2025-01-31 19:09:19,320] Trial 10 finished with value: 43.438786802351885 and parameters: {'C': 0.5279459809341532, 'epsilon': 0.13167376364098266, 'kernel': 'linear', 'gamma': 'auto'}. Best is trial 6 with value: 42.489951952203356.
[I 2025-01-31 19:09:22,526] Trial 11 finished with value: 41.53655571388608 and parameters: {'C': 0.3361063581139065, 'epsilon': 0.033339203038101325, 'kernel': 'linear', 'gamma': 'auto'}. Best is trial 11 with value: 41.53655571388608.
[I 2025-01-31 19:09:25,844] Trial 12 finished with value: 48.94701370517363 and parameters: {'C': 1.1454704023081075, 'epsilon': 0.05371283641396889, 'kernel': 'linear', 'gamma': 'auto'}. Best is trial 11 with value: 41.53655571388608.
[I 2025-01-31 19:09:28,943] Trial 13 finished with value: 47.586164771741736 and parameters: {'C': 0.16176541492540458, 'epsilon': 0.9860589750127803, 'kernel': 'linear', 'gamma': 'auto'}. Best is trial 11 with value: 41.53655571388608.
[I 2025-01-31 19:09:32,216] Trial 14 finished with value: 42.50967307002727 and parameters: {'C': 1.901937825989149, 'epsilon': 0.2835076516885068, 'kernel': 'linear', 'gamma': 'auto'}. Best is trial 11 with value: 41.53655571388608.
[I 2025-01-31 19:09:36,131] Trial 15 finished with value: 46.22390683268367 and parameters: {'C': 837.0284867399693, 'epsilon': 0.42267781751574807, 'kernel': 'linear', 'gamma': 'auto'}. Best is trial 11 with value: 41.53655571388608.
[I 2025-01-31 19:09:39,272] Trial 16 finished with value: 36.577573707833 and parameters: {'C': 0.5092017178330055, 'epsilon': 0.22481262276530045, 'kernel': 'linear', 'gamma': 'auto'}. Best is trial 16 with value: 36.577573707833.
[I 2025-01-31 19:09:42,562] Trial 17 finished with value: 38.344558540900024 and parameters: {'C': 0.10804697122963855, 'epsilon': 0.200943698216612, 'kernel': 'linear', 'gamma': 'auto'}. Best is trial 16 with value: 36.577573707833.
[I 2025-01-31 19:09:45,738] Trial 18 finished with value: 42.539541797582444 and parameters: {'C': 0.14449006991641195, 'epsilon': 0.2096495257500953, 'kernel': 'rbf', 'gamma': 'auto'}. Best is trial 16 with value: 36.577573707833.
[I 2025-01-31 19:09:48,864] Trial 19 finished with value: 40.37127811266409 and parameters: {'C': 0.6290568391725638, 'epsilon': 0.361795036742082, 'kernel': 'sigmoid', 'gamma': 'auto'}. Best is trial 16 with value: 36.577573707833.
[I 2025-01-31 19:09:52,136] Trial 20 finished with value: 46.6945194866948 and parameters: {'C': 2.391826733876145, 'epsilon': 0.17183429456001711, 'kernel': 'linear', 'gamma': 'auto'}. Best is trial 16 with value: 36.577573707833.
[I 2025-01-31 19:09:55,267] Trial 21 finished with value: 39.733853245872766 and parameters: {'C': 0.6467731846757433, 'epsilon': 0.3604351932633014, 'kernel': 'sigmoid', 'gamma': 'auto'}. Best is trial 16 with value: 36.577573707833.
[I 2025-01-31 19:09:58,424] Trial 22 finished with value: 37.41869293719119 and parameters: {'C': 0.10296888772493643, 'epsilon': 0.26129088140174467, 'kernel': 'sigmoid', 'gamma': 'auto'}. Best is trial 16 with value: 36.577573707833.
[I 2025-01-31 19:10:01,744] Trial 23 finished with value: 36.39564658786178 and parameters: {'C': 0.10448797572908637, 'epsilon': 0.24691766709837387, 'kernel': 'sigmoid', 'gamma': 'auto'}. Best is trial 23 with value: 36.39564658786178.
[I 2025-01-31 19:10:04,916] Trial 24 finished with value: 33.868027125815665 and parameters: {'C': 0.264565217733907, 'epsilon': 0.2730663758306255, 'kernel': 'sigmoid', 'gamma': 'auto'}. Best is trial 24 with value: 33.868027125815665.
[I 2025-01-31 19:10:08,134] Trial 25 finished with value: 38.10177748666367 and parameters: {'C': 0.31009873288390594, 'epsilon': 0.09316001512673094, 'kernel': 'sigmoid', 'gamma': 'auto'}. Best is trial 24 with value: 33.868027125815665.
[I 2025-01-31 19:10:11,395] Trial 26 finished with value: 39.26289690412664 and parameters: {'C': 0.26028371395692745, 'epsilon': 0.455488625349978, 'kernel': 'sigmoid', 'gamma': 'auto'}. Best is trial 24 with value: 33.868027125815665.
[I 2025-01-31 19:10:14,563] Trial 27 finished with value: 47.72168632638048 and parameters: {'C': 0.9076586043695201, 'epsilon': 0.2686882831388427, 'kernel': 'sigmoid', 'gamma': 'auto'}. Best is trial 24 with value: 33.868027125815665.
[I 2025-01-31 19:10:17,829] Trial 28 finished with value: 90.13269091564707 and parameters: {'C': 2.9349345599863463, 'epsilon': 0.4009934556135813, 'kernel': 'sigmoid', 'gamma': 'auto'}. Best is trial 24 with value: 33.868027125815665.
[I 2025-01-31 19:10:20,997] Trial 29 finished with value: 40.58084628322327 and parameters: {'C': 0.42751045232396284, 'epsilon': 0.1656049693288547, 'kernel': 'sigmoid', 'gamma': 'auto'}. Best is trial 24 with value: 33.868027125815665.
[I 2025-01-31 19:10:24,136] Trial 30 finished with value: 38.389098228099506 and parameters: {'C': 0.22236769169603832, 'epsilon': 0.5318028157009735, 'kernel': 'sigmoid', 'gamma': 'auto'}. Best is trial 24 with value: 33.868027125815665.
[I 2025-01-31 19:10:27,404] Trial 31 finished with value: 39.95691112400819 and parameters: {'C': 0.10257074690083395, 'epsilon': 0.2915287933523091, 'kernel': 'sigmoid', 'gamma': 'auto'}. Best is trial 24 with value: 33.868027125815665.
[I 2025-01-31 19:10:30,556] Trial 32 finished with value: 34.3729386247302 and parameters: {'C': 0.11256086916304171, 'epsilon': 0.22615328586607591, 'kernel': 'sigmoid', 'gamma': 'auto'}. Best is trial 24 with value: 33.868027125815665.
[I 2025-01-31 19:10:33,759] Trial 33 finished with value: 39.63423300807537 and parameters: {'C': 0.2154673486784125, 'epsilon': 0.22544167023925138, 'kernel': 'sigmoid', 'gamma': 'auto'}. Best is trial 24 with value: 33.868027125815665.
[I 2025-01-31 19:10:37,023] Trial 34 finished with value: 37.94826632082083 and parameters: {'C': 0.3895848326741486, 'epsilon': 0.1018386274771595, 'kernel': 'sigmoid', 'gamma': 'scale'}. Best is trial 24 with value: 33.868027125815665.
[I 2025-01-31 19:10:40,186] Trial 35 finished with value: 41.63285065149271 and parameters: {'C': 1.0520611596366807, 'epsilon': 0.33293506002156437, 'kernel': 'sigmoid', 'gamma': 'auto'}. Best is trial 24 with value: 33.868027125815665.
[I 2025-01-31 19:10:44,058] Trial 36 finished with value: 130.9787239657083 and parameters: {'C': 9.241949924871452, 'epsilon': 0.01352436883421071, 'kernel': 'poly', 'degree': 5, 'gamma': 'scale'}. Best is trial 24 with value: 33.868027125815665.
[I 2025-01-31 19:10:47,325] Trial 37 finished with value: 41.39274596703074 and parameters: {'C': 0.1513613097583871, 'epsilon': 0.14573017262431578, 'kernel': 'rbf', 'gamma': 'auto'}. Best is trial 24 with value: 33.868027125815665.
[I 2025-01-31 19:10:50,680] Trial 38 finished with value: 3953.143223703126 and parameters: {'C': 78.07147592715313, 'epsilon': 0.23598190054968027, 'kernel': 'sigmoid', 'gamma': 'auto'}. Best is trial 24 with value: 33.868027125815665.
[I 2025-01-31 19:10:53,865] Trial 39 finished with value: 62.25297477585269 and parameters: {'C': 0.5524535494241981, 'epsilon': 0.319023069948276, 'kernel': 'poly', 'degree': 2, 'gamma': 'scale'}. Best is trial 24 with value: 33.868027125815665.
[I 2025-01-31 19:10:57,038] Trial 40 finished with value: 112.7850986364771 and parameters: {'C': 3.386627603323941, 'epsilon': 0.38905841609826325, 'kernel': 'sigmoid', 'gamma': 'auto'}. Best is trial 24 with value: 33.868027125815665.
[I 2025-01-31 19:11:00,349] Trial 41 finished with value: 38.72415765711813 and parameters: {'C': 0.10089418682565734, 'epsilon': 0.2764009180529208, 'kernel': 'sigmoid', 'gamma': 'auto'}. Best is trial 24 with value: 33.868027125815665.
[I 2025-01-31 19:11:03,568] Trial 42 finished with value: 37.91912149173013 and parameters: {'C': 0.1658724939465386, 'epsilon': 0.08017576646913233, 'kernel': 'sigmoid', 'gamma': 'auto'}. Best is trial 24 with value: 33.868027125815665.
[I 2025-01-31 19:11:06,780] Trial 43 finished with value: 36.90741579763354 and parameters: {'C': 0.26313345476268707, 'epsilon': 0.25028809512021766, 'kernel': 'sigmoid', 'gamma': 'auto'}. Best is trial 24 with value: 33.868027125815665.
[I 2025-01-31 19:11:10,070] Trial 44 finished with value: 40.94158650126039 and parameters: {'C': 0.2903912686972642, 'epsilon': 0.1938058360503499, 'kernel': 'sigmoid', 'gamma': 'auto'}. Best is trial 24 with value: 33.868027125815665.
[I 2025-01-31 19:11:13,232] Trial 45 finished with value: 45.956748940536336 and parameters: {'C': 1.612590958793278, 'epsilon': 0.5938346956566264, 'kernel': 'rbf', 'gamma': 'scale'}. Best is trial 24 with value: 33.868027125815665.
[I 2025-01-31 19:11:16,349] Trial 46 finished with value: 81.56911891834386 and parameters: {'C': 0.37103106720290546, 'epsilon': 0.12455637566979788, 'kernel': 'poly', 'degree': 4, 'gamma': 'auto'}. Best is trial 24 with value: 33.868027125815665.
[I 2025-01-31 19:11:19,592] Trial 47 finished with value: 41.31003284599403 and parameters: {'C': 0.7671422248186739, 'epsilon': 0.4764282757370115, 'kernel': 'sigmoid', 'gamma': 'auto'}. Best is trial 24 with value: 33.868027125815665.
[I 2025-01-31 19:11:22,722] Trial 48 finished with value: 34.63455019122771 and parameters: {'C': 0.20640244334445673, 'epsilon': 0.3098826680676945, 'kernel': 'linear', 'gamma': 'auto'}. Best is trial 24 with value: 33.868027125815665.
[I 2025-01-31 19:11:25,875] Trial 49 finished with value: 39.790584497854574 and parameters: {'C': 0.16079059803830645, 'epsilon': 0.4369578980128229, 'kernel': 'linear', 'gamma': 'scale'}. Best is trial 24 with value: 33.868027125815665.
Best parameters for SVR: {'C': 0.264565217733907, 'epsilon': 0.2730663758306255, 'kernel': 'sigmoid', 'gamma': 'auto'}
Best MAPE for SVR: 33.868027125815665
Results for SVR: R2 = -0.493609644322888, MSE = 0.49849972923931096, MAE = 0.49570040757317924, MAPE = 35.38399218417663%

Bar Plot for Feature Importance:
  0%|          | 0/3 [00:00<?, ?it/s]100%|██████████| 3/3 [00:00<00:00, 234.08it/s]

Generating SHAP Summary Plot...
  0%|          | 0/3 [00:00<?, ?it/s]100%|██████████| 3/3 [00:00<00:00, 238.88it/s]
[I 2025-01-31 19:11:34,168] A new study created in memory with name: no-name-29341bf6-0a6e-428e-b673-00adcfe34e63
[I 2025-01-31 19:11:45,677] Trial 0 finished with value: 86.35241717606539 and parameters: {'activation': 'relu', 'alpha': 0.007891321787830837, 'learning_rate_init': 0.0013284765443867777, 'max_iter': 261877}. Best is trial 0 with value: 86.35241717606539.
[I 2025-01-31 19:11:50,206] Trial 1 finished with value: 42.243823429252735 and parameters: {'activation': 'tanh', 'alpha': 0.00013964007180824559, 'learning_rate_init': 0.00809865491769826, 'max_iter': 662324}. Best is trial 1 with value: 42.243823429252735.
[I 2025-01-31 19:11:55,472] Trial 2 finished with value: 41.80332680284553 and parameters: {'activation': 'tanh', 'alpha': 5.2201338727023674e-05, 'learning_rate_init': 0.013894188233033362, 'max_iter': 75107}. Best is trial 2 with value: 41.80332680284553.
[I 2025-01-31 19:12:24,319] Trial 3 finished with value: 35.968637227940846 and parameters: {'activation': 'tanh', 'alpha': 0.0023299124450574444, 'learning_rate_init': 0.00020571801159012269, 'max_iter': 948911}. Best is trial 3 with value: 35.968637227940846.
[I 2025-01-31 19:12:34,552] Trial 4 finished with value: 40.016237060782835 and parameters: {'activation': 'tanh', 'alpha': 3.6939622864237075e-05, 'learning_rate_init': 0.0009931865517774897, 'max_iter': 486549}. Best is trial 3 with value: 35.968637227940846.
[I 2025-01-31 19:12:41,534] Trial 5 finished with value: 40.63677538672486 and parameters: {'activation': 'logistic', 'alpha': 0.00032031252907770467, 'learning_rate_init': 0.012489087456038911, 'max_iter': 243230}. Best is trial 3 with value: 35.968637227940846.
[I 2025-01-31 19:12:45,976] Trial 6 finished with value: 38.79577619870714 and parameters: {'activation': 'tanh', 'alpha': 2.7192411764475757e-05, 'learning_rate_init': 0.006212594634567791, 'max_iter': 151721}. Best is trial 3 with value: 35.968637227940846.
[I 2025-01-31 19:12:54,864] Trial 7 finished with value: 34.94960348514821 and parameters: {'activation': 'tanh', 'alpha': 0.03825882297355535, 'learning_rate_init': 0.0013036441086481964, 'max_iter': 574928}. Best is trial 7 with value: 34.94960348514821.
[I 2025-01-31 19:13:06,145] Trial 8 finished with value: 43.133977727853406 and parameters: {'activation': 'logistic', 'alpha': 0.09948055292549522, 'learning_rate_init': 0.0019814793230686616, 'max_iter': 449540}. Best is trial 7 with value: 34.94960348514821.
[I 2025-01-31 19:13:10,951] Trial 9 finished with value: 40.442456965941396 and parameters: {'activation': 'tanh', 'alpha': 0.02357241718924786, 'learning_rate_init': 0.00403008324764477, 'max_iter': 4403}. Best is trial 7 with value: 34.94960348514821.
[I 2025-01-31 19:13:17,079] Trial 10 finished with value: 83.0209975411219 and parameters: {'activation': 'relu', 'alpha': 0.0013048964888980096, 'learning_rate_init': 0.05304051903521467, 'max_iter': 716311}. Best is trial 7 with value: 34.94960348514821.
[I 2025-01-31 19:13:55,849] Trial 11 finished with value: 41.94152051564227 and parameters: {'activation': 'tanh', 'alpha': 0.0032453940474360806, 'learning_rate_init': 0.00013826669017873866, 'max_iter': 944591}. Best is trial 7 with value: 34.94960348514821.
[I 2025-01-31 19:14:21,320] Trial 12 finished with value: 34.93249458811361 and parameters: {'activation': 'tanh', 'alpha': 0.08185157150751629, 'learning_rate_init': 0.00023020005948405504, 'max_iter': 974365}. Best is trial 12 with value: 34.93249458811361.
[I 2025-01-31 19:14:45,791] Trial 13 finished with value: 99.36047606936414 and parameters: {'activation': 'relu', 'alpha': 0.054775728741809075, 'learning_rate_init': 0.00038074061634303733, 'max_iter': 761888}. Best is trial 12 with value: 34.93249458811361.
[I 2025-01-31 19:15:15,146] Trial 14 finished with value: 40.193375710593024 and parameters: {'activation': 'logistic', 'alpha': 0.012009434613237197, 'learning_rate_init': 0.00046589309215966276, 'max_iter': 834619}. Best is trial 12 with value: 34.93249458811361.
[I 2025-01-31 19:15:29,487] Trial 15 finished with value: 37.549640423286434 and parameters: {'activation': 'tanh', 'alpha': 0.032849441777540275, 'learning_rate_init': 0.0005819974075061007, 'max_iter': 558854}. Best is trial 12 with value: 34.93249458811361.
[I 2025-01-31 19:16:17,612] Trial 16 finished with value: 36.38059431518314 and parameters: {'activation': 'tanh', 'alpha': 0.009315368429080668, 'learning_rate_init': 0.00010489930906100483, 'max_iter': 369065}. Best is trial 12 with value: 34.93249458811361.
[I 2025-01-31 19:16:42,156] Trial 17 finished with value: 38.81635504007614 and parameters: {'activation': 'tanh', 'alpha': 0.09180506480695236, 'learning_rate_init': 0.00024954515863631377, 'max_iter': 602738}. Best is trial 12 with value: 34.93249458811361.
[I 2025-01-31 19:16:55,842] Trial 18 finished with value: 91.10914415013787 and parameters: {'activation': 'relu', 'alpha': 0.00041614105340997336, 'learning_rate_init': 0.0009679245354225333, 'max_iter': 818131}. Best is trial 12 with value: 34.93249458811361.
[I 2025-01-31 19:17:01,949] Trial 19 finished with value: 40.32980439229541 and parameters: {'activation': 'logistic', 'alpha': 0.02042133210757994, 'learning_rate_init': 0.09560911803341872, 'max_iter': 988440}. Best is trial 12 with value: 34.93249458811361.
[I 2025-01-31 19:17:07,288] Trial 20 finished with value: 38.25675792847535 and parameters: {'activation': 'tanh', 'alpha': 0.005184656359151233, 'learning_rate_init': 0.002978225696054805, 'max_iter': 860810}. Best is trial 12 with value: 34.93249458811361.
[I 2025-01-31 19:17:34,899] Trial 21 finished with value: 43.109710599617856 and parameters: {'activation': 'tanh', 'alpha': 0.000972190776127992, 'learning_rate_init': 0.00021015393338869425, 'max_iter': 914635}. Best is trial 12 with value: 34.93249458811361.
[I 2025-01-31 19:17:59,512] Trial 22 finished with value: 39.090489404441286 and parameters: {'activation': 'tanh', 'alpha': 0.0020645397540537624, 'learning_rate_init': 0.0002445404301950226, 'max_iter': 984124}. Best is trial 12 with value: 34.93249458811361.
[I 2025-01-31 19:18:13,142] Trial 23 finished with value: 38.43570780639861 and parameters: {'activation': 'tanh', 'alpha': 0.03710594666522566, 'learning_rate_init': 0.0006126000929980777, 'max_iter': 757884}. Best is trial 12 with value: 34.93249458811361.
[I 2025-01-31 19:18:48,210] Trial 24 finished with value: 34.842098100589666 and parameters: {'activation': 'tanh', 'alpha': 0.015524558469708348, 'learning_rate_init': 0.0001564991044169341, 'max_iter': 896905}. Best is trial 24 with value: 34.842098100589666.
[I 2025-01-31 19:19:28,879] Trial 25 finished with value: 41.275999535217636 and parameters: {'activation': 'tanh', 'alpha': 0.01690309177336616, 'learning_rate_init': 0.0001302221694921267, 'max_iter': 622542}. Best is trial 24 with value: 34.842098100589666.
[I 2025-01-31 19:19:47,889] Trial 26 finished with value: 39.689122838593384 and parameters: {'activation': 'tanh', 'alpha': 0.05629812875142282, 'learning_rate_init': 0.0003566612731593712, 'max_iter': 877057}. Best is trial 24 with value: 34.842098100589666.
[I 2025-01-31 19:19:55,994] Trial 27 finished with value: 38.013000493568434 and parameters: {'activation': 'tanh', 'alpha': 0.005281107488461007, 'learning_rate_init': 0.0016669001900229555, 'max_iter': 691771}. Best is trial 24 with value: 34.842098100589666.
[I 2025-01-31 19:20:11,357] Trial 28 finished with value: 89.296110550167 and parameters: {'activation': 'relu', 'alpha': 0.05025293864668892, 'learning_rate_init': 0.0007504720675935442, 'max_iter': 402518}. Best is trial 24 with value: 34.842098100589666.
[I 2025-01-31 19:20:26,547] Trial 29 finished with value: 39.49041025976062 and parameters: {'activation': 'logistic', 'alpha': 0.007225214035182831, 'learning_rate_init': 0.0012785017494541587, 'max_iter': 313267}. Best is trial 24 with value: 34.842098100589666.
[I 2025-01-31 19:20:34,705] Trial 30 finished with value: 92.6963638419335 and parameters: {'activation': 'relu', 'alpha': 1.1740280151053625e-05, 'learning_rate_init': 0.002480577693249021, 'max_iter': 545352}. Best is trial 24 with value: 34.842098100589666.
[I 2025-01-31 19:21:09,653] Trial 31 finished with value: 37.16092282620706 and parameters: {'activation': 'tanh', 'alpha': 0.01412961173879597, 'learning_rate_init': 0.00015587934890952518, 'max_iter': 924666}. Best is trial 24 with value: 34.842098100589666.
[I 2025-01-31 19:21:31,403] Trial 32 finished with value: 38.47278160744273 and parameters: {'activation': 'tanh', 'alpha': 0.002984202778955139, 'learning_rate_init': 0.00030384751290703184, 'max_iter': 793204}. Best is trial 24 with value: 34.842098100589666.
[I 2025-01-31 19:22:00,337] Trial 33 finished with value: 38.96030788733681 and parameters: {'activation': 'tanh', 'alpha': 0.03264669336563571, 'learning_rate_init': 0.00020175797304338239, 'max_iter': 988265}. Best is trial 24 with value: 34.842098100589666.
