[I 2025-01-31 20:23:57,267] Trial 26 finished with value: 43.67802093470738 and parameters: {'n_estimators': 387, 'max_depth': 12, 'learning_rate': 0.29064053906439197, 'reg_alpha': 0.015229858044200049, 'reg_lambda': 0.0014218136896561305, 'subsample': 0.9681581991253972, 'colsample_bytree': 0.9564724500531308, 'gamma': 1.6027952716429044, 'min_child_weight': 7}. Best is trial 16 with value: 37.81245845182344.
[I 2025-01-31 20:24:02,655] Trial 27 finished with value: 42.746458969715185 and parameters: {'n_estimators': 179, 'max_depth': 7, 'learning_rate': 0.16236151924216974, 'reg_alpha': 0.00033443876300805534, 'reg_lambda': 0.0056971871397166205, 'subsample': 0.8348438006395016, 'colsample_bytree': 0.8833605261873437, 'gamma': 0.00894275483319995, 'min_child_weight': 8}. Best is trial 16 with value: 37.81245845182344.
[I 2025-01-31 20:24:09,744] Trial 28 finished with value: 38.46441333042274 and parameters: {'n_estimators': 436, 'max_depth': 10, 'learning_rate': 0.21984855335569248, 'reg_alpha': 6.910553399498036e-05, 'reg_lambda': 0.025417917581682478, 'subsample': 0.8976812827862778, 'colsample_bytree': 0.827956249122587, 'gamma': 1.9341615488587853, 'min_child_weight': 5}. Best is trial 16 with value: 37.81245845182344.
[I 2025-01-31 20:24:16,185] Trial 29 finished with value: 38.23163104841298 and parameters: {'n_estimators': 345, 'max_depth': 6, 'learning_rate': 0.07668118178504267, 'reg_alpha': 0.002065200321690758, 'reg_lambda': 0.12775990037578475, 'subsample': 0.9710329418819715, 'colsample_bytree': 0.6783343292776243, 'gamma': 0.30293310882022606, 'min_child_weight': 8}. Best is trial 16 with value: 37.81245845182344.
[I 2025-01-31 20:24:22,612] Trial 30 finished with value: 40.27323239162574 and parameters: {'n_estimators': 355, 'max_depth': 17, 'learning_rate': 0.11246995512098078, 'reg_alpha': 0.006243450486649541, 'reg_lambda': 0.0066484454035553074, 'subsample': 0.9211259363879275, 'colsample_bytree': 0.9398572916195492, 'gamma': 3.1043213101063984, 'min_child_weight': 9}. Best is trial 16 with value: 37.81245845182344.
[I 2025-01-31 20:24:28,885] Trial 31 finished with value: 45.67220142166132 and parameters: {'n_estimators': 336, 'max_depth': 5, 'learning_rate': 0.0840340359301631, 'reg_alpha': 0.0018446388101048363, 'reg_lambda': 0.11114723113483467, 'subsample': 0.9986236196256261, 'colsample_bytree': 0.6524958595991495, 'gamma': 0.251584054835101, 'min_child_weight': 8}. Best is trial 16 with value: 37.81245845182344.
[I 2025-01-31 20:24:35,386] Trial 32 finished with value: 43.43038908368532 and parameters: {'n_estimators': 347, 'max_depth': 6, 'learning_rate': 0.06821628222402797, 'reg_alpha': 0.002603390283969436, 'reg_lambda': 0.18656268144352714, 'subsample': 0.9683850421243524, 'colsample_bytree': 0.7218190657523055, 'gamma': 0.5182335327267722, 'min_child_weight': 7}. Best is trial 16 with value: 37.81245845182344.
[I 2025-01-31 20:24:41,525] Trial 33 finished with value: 41.88264079034242 and parameters: {'n_estimators': 310, 'max_depth': 4, 'learning_rate': 0.04471143550384632, 'reg_alpha': 1.0046455443448856e-05, 'reg_lambda': 2.2872969088065177e-05, 'subsample': 0.9501409702072674, 'colsample_bytree': 0.671819477769312, 'gamma': 0.8979576797010836, 'min_child_weight': 10}. Best is trial 16 with value: 37.81245845182344.
[I 2025-01-31 20:24:47,212] Trial 34 finished with value: 45.435617849272624 and parameters: {'n_estimators': 240, 'max_depth': 7, 'learning_rate': 0.14974045582425674, 'reg_alpha': 0.00048159962766561624, 'reg_lambda': 7.063340078910146e-05, 'subsample': 0.8718539977622946, 'colsample_bytree': 0.9727654814971326, 'gamma': 0.022960972418251124, 'min_child_weight': 8}. Best is trial 16 with value: 37.81245845182344.
[I 2025-01-31 20:24:53,303] Trial 35 finished with value: 48.53558079483495 and parameters: {'n_estimators': 300, 'max_depth': 8, 'learning_rate': 0.07663714546238998, 'reg_alpha': 2.290943598318016e-05, 'reg_lambda': 0.38760566999048207, 'subsample': 0.8154405861091086, 'colsample_bytree': 0.788021344707029, 'gamma': 0.36887542829539294, 'min_child_weight': 6}. Best is trial 16 with value: 37.81245845182344.
[I 2025-01-31 20:25:00,105] Trial 36 finished with value: 40.04107938387831 and parameters: {'n_estimators': 396, 'max_depth': 4, 'learning_rate': 0.10382833130855945, 'reg_alpha': 0.0011495533139289288, 'reg_lambda': 0.0006261333188492032, 'subsample': 0.8314327874779704, 'colsample_bytree': 0.7147362589780335, 'gamma': 3.8790331106693996, 'min_child_weight': 3}. Best is trial 16 with value: 37.81245845182344.
[I 2025-01-31 20:25:06,776] Trial 37 finished with value: 43.208022204738285 and parameters: {'n_estimators': 373, 'max_depth': 9, 'learning_rate': 0.12889474504436646, 'reg_alpha': 0.01584286879264453, 'reg_lambda': 0.08858159873207527, 'subsample': 0.8966650026632416, 'colsample_bytree': 0.9260880712178409, 'gamma': 2.449788753789036, 'min_child_weight': 9}. Best is trial 16 with value: 37.81245845182344.
[I 2025-01-31 20:25:13,885] Trial 38 finished with value: 41.46444574070031 and parameters: {'n_estimators': 431, 'max_depth': 7, 'learning_rate': 0.0503575982322725, 'reg_alpha': 0.00010795447348380409, 'reg_lambda': 0.863397256938555, 'subsample': 0.7884336400363029, 'colsample_bytree': 0.6808564687988865, 'gamma': 1.294085890978022, 'min_child_weight': 7}. Best is trial 16 with value: 37.81245845182344.
[I 2025-01-31 20:25:19,925] Trial 39 finished with value: 44.36639002238907 and parameters: {'n_estimators': 288, 'max_depth': 12, 'learning_rate': 0.03624735143450058, 'reg_alpha': 0.00022199410191349068, 'reg_lambda': 0.00020642376195356384, 'subsample': 0.7450011789997185, 'colsample_bytree': 0.7826250686289565, 'gamma': 0.750271953689734, 'min_child_weight': 10}. Best is trial 16 with value: 37.81245845182344.
[I 2025-01-31 20:25:25,692] Trial 40 finished with value: 40.90302655940626 and parameters: {'n_estimators': 271, 'max_depth': 10, 'learning_rate': 0.1739500191911839, 'reg_alpha': 0.00391457368110424, 'reg_lambda': 0.0014922373734548317, 'subsample': 0.9337538181459888, 'colsample_bytree': 0.7418813098461693, 'gamma': 1.0558008611110203, 'min_child_weight': 4}. Best is trial 16 with value: 37.81245845182344.
[I 2025-01-31 20:25:30,802] Trial 41 finished with value: 44.40549828358238 and parameters: {'n_estimators': 133, 'max_depth': 11, 'learning_rate': 0.01182352605932398, 'reg_alpha': 0.2073228789069723, 'reg_lambda': 0.03540878246070528, 'subsample': 0.8004965917032112, 'colsample_bytree': 0.6078108197822647, 'gamma': 4.98005572011531, 'min_child_weight': 1}. Best is trial 16 with value: 37.81245845182344.
[I 2025-01-31 20:25:35,514] Trial 42 finished with value: 40.06458046878729 and parameters: {'n_estimators': 104, 'max_depth': 13, 'learning_rate': 0.016992094140688085, 'reg_alpha': 0.04173479683143829, 'reg_lambda': 0.09188740204809541, 'subsample': 0.8044802007430033, 'colsample_bytree': 0.633108580925858, 'gamma': 4.767235604404105, 'min_child_weight': 3}. Best is trial 16 with value: 37.81245845182344.
[I 2025-01-31 20:25:40,846] Trial 43 finished with value: 48.160550743028914 and parameters: {'n_estimators': 183, 'max_depth': 3, 'learning_rate': 0.02210031780562828, 'reg_alpha': 0.17406999147089694, 'reg_lambda': 0.009121316393445605, 'subsample': 0.8405183100196971, 'colsample_bytree': 0.6352390654926657, 'gamma': 3.754167142226816, 'min_child_weight': 2}. Best is trial 16 with value: 37.81245845182344.
[I 2025-01-31 20:25:46,127] Trial 44 finished with value: 40.4741551165461 and parameters: {'n_estimators': 155, 'max_depth': 6, 'learning_rate': 0.011190944894809035, 'reg_alpha': 0.08145461972630458, 'reg_lambda': 0.018567080008479786, 'subsample': 0.7011688172523013, 'colsample_bytree': 0.6817405889219348, 'gamma': 3.007913293534259, 'min_child_weight': 6}. Best is trial 16 with value: 37.81245845182344.
[I 2025-01-31 20:25:52,621] Trial 45 finished with value: 44.43671025533776 and parameters: {'n_estimators': 370, 'max_depth': 11, 'learning_rate': 0.2508460967034052, 'reg_alpha': 0.008660500635169576, 'reg_lambda': 0.0034312538611146718, 'subsample': 0.8598606398735362, 'colsample_bytree': 0.6011343664353274, 'gamma': 4.515687159406545, 'min_child_weight': 5}. Best is trial 16 with value: 37.81245845182344.
[I 2025-01-31 20:25:59,470] Trial 46 finished with value: 51.4580263567489 and parameters: {'n_estimators': 359, 'max_depth': 14, 'learning_rate': 0.03972850700367235, 'reg_alpha': 0.0005713118489606851, 'reg_lambda': 0.2241415135894566, 'subsample': 0.7708857701596029, 'colsample_bytree': 0.8827984480200809, 'gamma': 0.3001755015838809, 'min_child_weight': 8}. Best is trial 16 with value: 37.81245845182344.
[I 2025-01-31 20:26:06,743] Trial 47 finished with value: 39.839734528255676 and parameters: {'n_estimators': 460, 'max_depth': 9, 'learning_rate': 0.2365576225112914, 'reg_alpha': 0.7957229635929972, 'reg_lambda': 0.04606001455939452, 'subsample': 0.8841834362385688, 'colsample_bytree': 0.9062427305262009, 'gamma': 1.5147035874997967, 'min_child_weight': 3}. Best is trial 16 with value: 37.81245845182344.
[I 2025-01-31 20:26:12,249] Trial 48 finished with value: 46.492599967895266 and parameters: {'n_estimators': 194, 'max_depth': 8, 'learning_rate': 0.028639753506011938, 'reg_alpha': 2.85177533440889e-05, 'reg_lambda': 0.38809544928621553, 'subsample': 0.8228043002942379, 'colsample_bytree': 0.9841192330081444, 'gamma': 3.6147103069866082, 'min_child_weight': 9}. Best is trial 16 with value: 37.81245845182344.
[I 2025-01-31 20:26:18,540] Trial 49 finished with value: 42.79347172293745 and parameters: {'n_estimators': 330, 'max_depth': 10, 'learning_rate': 0.18599896388949402, 'reg_alpha': 0.0020567391180536005, 'reg_lambda': 0.0008397526486552389, 'subsample': 0.9807333225223402, 'colsample_bytree': 0.8697028538923562, 'gamma': 4.226671881000696, 'min_child_weight': 7}. Best is trial 16 with value: 37.81245845182344.
SHAP summary plot saved to Figs/SHAPsum_GradientBoostingRegressor_False.png

Predict vs. Reality:
Initialized tuner for XGBRegressor. Running optimization...
Best parameters for XGBRegressor: {'n_estimators': 234, 'max_depth': 9, 'learning_rate': 0.20485891334887363, 'reg_alpha': 3.300348460786662e-05, 'reg_lambda': 0.0002046267310787393, 'subsample': 0.8340725439796275, 'colsample_bytree': 0.9289938770387536, 'gamma': 2.5788719641855016, 'min_child_weight': 9}
Best MAPE for XGBRegressor: 37.81245845182344
Results for XGBRegressor: R2 = 0.26703494787216187, MSE = 0.26233530044555664, MAE = 0.38625508546829224, MAPE = 23.875675840816342%

Bar Plot for Feature Importance:
Skipping visualization for XGBRegressor: property 'feature_names_in_' of 'XGBRegressor' object has no setter

Final Results:
                       Model Use Chain  R2 Score       MSE       MAE       MAPE
0                        SVR        No -0.493610  0.498500  0.495700  35.383992
1               MLPRegressor        No -1.425524  0.821621  0.616001  60.605501
2              BayesianRidge        No -2.240049  1.080741  0.685251  77.203104
3                 ElasticNet        No -0.151453  0.374922  0.422991  38.823841
4      RandomForestRegressor        No  0.166975  0.122921  0.262262  13.104112
5  GradientBoostingRegressor        No -2.513128  1.240289  0.851828  62.170177
6               XGBRegressor        No  0.267035  0.262335  0.386255  23.875676
Results saved.
