[I 2025-01-31 19:30:12,925] Trial 10 finished with value: 42.375951334856 and parameters: {'alpha': 839.5609937634775, 'l1_ratio': 0.1737857110957985, 'max_iter': 6976844}. Best is trial 9 with value: 29.28647292631998.
[I 2025-01-31 19:30:16,131] Trial 11 finished with value: 39.178429010641565 and parameters: {'alpha': 138.22977573284805, 'l1_ratio': 0.9712023168070644, 'max_iter': 5963465}. Best is trial 9 with value: 29.28647292631998.
[I 2025-01-31 19:30:19,304] Trial 12 finished with value: 38.60258588670786 and parameters: {'alpha': 0.01626620968823243, 'l1_ratio': 0.632041891680327, 'max_iter': 7589871}. Best is trial 9 with value: 29.28647292631998.
[I 2025-01-31 19:30:22,552] Trial 13 finished with value: 38.730556444403895 and parameters: {'alpha': 0.019584891191301402, 'l1_ratio': 0.6410307136710205, 'max_iter': 8125714}. Best is trial 9 with value: 29.28647292631998.
[I 2025-01-31 19:30:25,728] Trial 14 finished with value: 40.546158714982575 and parameters: {'alpha': 0.013676562954984582, 'l1_ratio': 0.47741568186488287, 'max_iter': 9757601}. Best is trial 9 with value: 29.28647292631998.
[I 2025-01-31 19:30:28,966] Trial 15 finished with value: 52.91884732793208 and parameters: {'alpha': 0.0015554823121681652, 'l1_ratio': 0.7072762287575282, 'max_iter': 7740141}. Best is trial 9 with value: 29.28647292631998.
[I 2025-01-31 19:30:32,236] Trial 16 finished with value: 32.36928296861067 and parameters: {'alpha': 0.19051364263695927, 'l1_ratio': 0.33926392520572846, 'max_iter': 8892773}. Best is trial 9 with value: 29.28647292631998.
[I 2025-01-31 19:30:35,401] Trial 17 finished with value: 34.34132774120533 and parameters: {'alpha': 0.2068782297396869, 'l1_ratio': 0.29937996794040705, 'max_iter': 9029876}. Best is trial 9 with value: 29.28647292631998.
[I 2025-01-31 19:30:38,660] Trial 18 finished with value: 40.70980742359618 and parameters: {'alpha': 3.724709824571962, 'l1_ratio': 0.12825084251024674, 'max_iter': 5628570}. Best is trial 9 with value: 29.28647292631998.
[I 2025-01-31 19:30:41,800] Trial 19 finished with value: 34.78247316071639 and parameters: {'alpha': 0.0859414701423123, 'l1_ratio': 0.3187790637356834, 'max_iter': 6871409}. Best is trial 9 with value: 29.28647292631998.
[I 2025-01-31 19:30:45,014] Trial 20 finished with value: 43.742480663402695 and parameters: {'alpha': 6.353210295154651, 'l1_ratio': 0.20606751257326944, 'max_iter': 8930968}. Best is trial 9 with value: 29.28647292631998.
[I 2025-01-31 19:30:48,150] Trial 21 finished with value: 40.33275878717519 and parameters: {'alpha': 0.1833982182005031, 'l1_ratio': 0.32972745184124413, 'max_iter': 9685575}. Best is trial 9 with value: 29.28647292631998.
[I 2025-01-31 19:30:51,565] Trial 22 finished with value: 56.23042922607254 and parameters: {'alpha': 1.1252990243389018e-05, 'l1_ratio': 0.24321442813604513, 'max_iter': 8838459}. Best is trial 9 with value: 29.28647292631998.
[I 2025-01-31 19:30:54,729] Trial 23 finished with value: 36.07633015763498 and parameters: {'alpha': 0.053871500904659406, 'l1_ratio': 0.41719235720557823, 'max_iter': 6985877}. Best is trial 9 with value: 29.28647292631998.
[I 2025-01-31 19:30:57,878] Trial 24 finished with value: 32.47490219681825 and parameters: {'alpha': 0.18841282319801192, 'l1_ratio': 0.5234142063595115, 'max_iter': 8976323}. Best is trial 9 with value: 29.28647292631998.
[I 2025-01-31 19:31:01,163] Trial 25 finished with value: 47.35577513045148 and parameters: {'alpha': 0.001882241329096478, 'l1_ratio': 0.5533765342004724, 'max_iter': 7728942}. Best is trial 9 with value: 29.28647292631998.
[I 2025-01-31 19:31:04,345] Trial 26 finished with value: 44.19186868183763 and parameters: {'alpha': 22.111947133170844, 'l1_ratio': 0.49794275629139323, 'max_iter': 8399043}. Best is trial 9 with value: 29.28647292631998.
[I 2025-01-31 19:31:07,476] Trial 27 finished with value: 39.96460615196024 and parameters: {'alpha': 1.5947572451945657, 'l1_ratio': 0.4171618441760813, 'max_iter': 9964469}. Best is trial 9 with value: 29.28647292631998.
[I 2025-01-31 19:31:10,646] Trial 28 finished with value: 35.4389378590126 and parameters: {'alpha': 0.04684328932521183, 'l1_ratio': 0.7216201526324014, 'max_iter': 5493501}. Best is trial 9 with value: 29.28647292631998.
[I 2025-01-31 19:31:13,785] Trial 29 finished with value: 41.264845155603005 and parameters: {'alpha': 1.7075323932698332, 'l1_ratio': 0.61105951115251, 'max_iter': 6581762}. Best is trial 9 with value: 29.28647292631998.
[I 2025-01-31 19:31:16,891] Trial 30 finished with value: 37.780830489780385 and parameters: {'alpha': 0.3511232889578014, 'l1_ratio': 0.3595612135875364, 'max_iter': 9291193}. Best is trial 9 with value: 29.28647292631998.
[I 2025-01-31 19:31:20,114] Trial 31 finished with value: 35.311843799600595 and parameters: {'alpha': 0.152173224290545, 'l1_ratio': 0.26060967601995666, 'max_iter': 9130589}. Best is trial 9 with value: 29.28647292631998.
[I 2025-01-31 19:31:23,304] Trial 32 finished with value: 38.04598128679028 and parameters: {'alpha': 0.3628924015974882, 'l1_ratio': 0.5317299472910243, 'max_iter': 8279342}. Best is trial 9 with value: 29.28647292631998.
[I 2025-01-31 19:31:26,496] Trial 33 finished with value: 43.33140952694197 and parameters: {'alpha': 0.004091824694955327, 'l1_ratio': 0.3683130615124934, 'max_iter': 7393955}. Best is trial 9 with value: 29.28647292631998.
[I 2025-01-31 19:31:29,778] Trial 34 finished with value: 41.73142119300208 and parameters: {'alpha': 1.4888403286876168, 'l1_ratio': 0.2955545803830293, 'max_iter': 2127066}. Best is trial 9 with value: 29.28647292631998.
[I 2025-01-31 19:31:32,986] Trial 35 finished with value: 32.430325026961114 and parameters: {'alpha': 0.05172262962255509, 'l1_ratio': 0.511159277374271, 'max_iter': 4894158}. Best is trial 9 with value: 29.28647292631998.
[I 2025-01-31 19:31:36,139] Trial 36 finished with value: 36.133711572274144 and parameters: {'alpha': 0.04440509795883077, 'l1_ratio': 0.5204031479734849, 'max_iter': 4427329}. Best is trial 9 with value: 29.28647292631998.
[I 2025-01-31 19:31:39,240] Trial 37 finished with value: 40.04226053662778 and parameters: {'alpha': 0.8343434441002798, 'l1_ratio': 0.6757749520010855, 'max_iter': 4984215}. Best is trial 9 with value: 29.28647292631998.
[I 2025-01-31 19:31:42,435] Trial 38 finished with value: 43.31818672815637 and parameters: {'alpha': 0.006656772987453147, 'l1_ratio': 0.7798916800933828, 'max_iter': 2538175}. Best is trial 9 with value: 29.28647292631998.
[I 2025-01-31 19:31:45,717] Trial 39 finished with value: 56.80729523436755 and parameters: {'alpha': 0.0005301357006877795, 'l1_ratio': 0.44732547098721576, 'max_iter': 92301}. Best is trial 9 with value: 29.28647292631998.
[I 2025-01-31 19:31:48,836] Trial 40 finished with value: 38.23545196991577 and parameters: {'alpha': 0.027598018978808314, 'l1_ratio': 0.5808216039157241, 'max_iter': 3421147}. Best is trial 9 with value: 29.28647292631998.
[I 2025-01-31 19:31:52,086] Trial 41 finished with value: 33.076158339719726 and parameters: {'alpha': 0.24179478770599047, 'l1_ratio': 0.3704656865712779, 'max_iter': 8692584}. Best is trial 9 with value: 29.28647292631998.
[I 2025-01-31 19:31:55,297] Trial 42 finished with value: 36.35705716951926 and parameters: {'alpha': 0.5101151504386134, 'l1_ratio': 0.4562652273702247, 'max_iter': 8618277}. Best is trial 9 with value: 29.28647292631998.
[I 2025-01-31 19:31:58,420] Trial 43 finished with value: 34.76026757344168 and parameters: {'alpha': 0.12128117594452076, 'l1_ratio': 0.3733982094392548, 'max_iter': 4626610}. Best is trial 9 with value: 29.28647292631998.
[I 2025-01-31 19:32:01,622] Trial 44 finished with value: 44.83580568811621 and parameters: {'alpha': 4.283539261046329, 'l1_ratio': 0.5796030101008856, 'max_iter': 6305015}. Best is trial 9 with value: 29.28647292631998.
[I 2025-01-31 19:32:04,800] Trial 45 finished with value: 41.73213123832205 and parameters: {'alpha': 22.476858395006683, 'l1_ratio': 0.5086171805333658, 'max_iter': 8009626}. Best is trial 9 with value: 29.28647292631998.
[I 2025-01-31 19:32:07,988] Trial 46 finished with value: 36.52544026815308 and parameters: {'alpha': 0.06913511149503913, 'l1_ratio': 0.4075347028590061, 'max_iter': 9417573}. Best is trial 9 with value: 29.28647292631998.
[I 2025-01-31 19:32:11,167] Trial 47 finished with value: 38.06174813190466 and parameters: {'alpha': 0.007212366237643623, 'l1_ratio': 0.47146593368176776, 'max_iter': 3813500}. Best is trial 9 with value: 29.28647292631998.
[I 2025-01-31 19:32:14,339] Trial 48 finished with value: 36.68182430998662 and parameters: {'alpha': 0.32163360380856754, 'l1_ratio': 0.557143691867608, 'max_iter': 7288304}. Best is trial 9 with value: 29.28647292631998.
[I 2025-01-31 19:32:17,661] Trial 49 finished with value: 35.37878499008545 and parameters: {'alpha': 0.024762793594697186, 'l1_ratio': 0.6481357118785778, 'max_iter': 9992186}. Best is trial 9 with value: 29.28647292631998.
SHAP summary plot saved to Figs/SHAPsum_BayesianRidge_False.png

Predict vs. Reality:
Initialized tuner for ElasticNet. Running optimization...
Best parameters for ElasticNet: {'alpha': 0.15274266941999942, 'l1_ratio': 0.5789392188701508, 'max_iter': 9193046}
Best MAPE for ElasticNet: 29.28647292631998
Results for ElasticNet: R2 = -0.1514532009248347, MSE = 0.37492181286025894, MAE = 0.42299135002744936, MAPE = 38.82384053086948%

Bar Plot for Feature Importance:
  0%|          | 0/3 [00:00<?, ?it/s]100%|██████████| 3/3 [00:00<00:00, 277.44it/s]

Generating SHAP Summary Plot...
  0%|          | 0/3 [00:00<?, ?it/s]100%|██████████| 3/3 [00:00<00:00, 284.45it/s]
[I 2025-01-31 19:32:23,805] A new study created in memory with name: no-name-b5930460-6173-4d52-9fcd-b8808e3f007c
[I 2025-01-31 19:33:09,532] Trial 0 finished with value: 45.319246416315856 and parameters: {'n_estimators': 356, 'max_depth': 10, 'min_samples_split': 8}. Best is trial 0 with value: 45.319246416315856.
[I 2025-01-31 19:34:00,542] Trial 1 finished with value: 48.38309101014174 and parameters: {'n_estimators': 405, 'max_depth': 7, 'min_samples_split': 9}. Best is trial 0 with value: 45.319246416315856.
[I 2025-01-31 19:34:26,499] Trial 2 finished with value: 55.4899441764978 and parameters: {'n_estimators': 204, 'max_depth': 17, 'min_samples_split': 15}. Best is trial 0 with value: 45.319246416315856.
[I 2025-01-31 19:34:52,168] Trial 3 finished with value: 51.15294304465646 and parameters: {'n_estimators': 200, 'max_depth': 11, 'min_samples_split': 14}. Best is trial 0 with value: 45.319246416315856.
[I 2025-01-31 19:35:38,077] Trial 4 finished with value: 53.3358297952547 and parameters: {'n_estimators': 335, 'max_depth': 20, 'min_samples_split': 3}. Best is trial 0 with value: 45.319246416315856.
[I 2025-01-31 19:36:15,246] Trial 5 finished with value: 49.32883581161133 and parameters: {'n_estimators': 303, 'max_depth': 4, 'min_samples_split': 12}. Best is trial 0 with value: 45.319246416315856.
[I 2025-01-31 19:36:31,208] Trial 6 finished with value: 51.614771884091276 and parameters: {'n_estimators': 103, 'max_depth': 20, 'min_samples_split': 4}. Best is trial 0 with value: 45.319246416315856.
[I 2025-01-31 19:37:28,034] Trial 7 finished with value: 47.8311956104165 and parameters: {'n_estimators': 453, 'max_depth': 10, 'min_samples_split': 9}. Best is trial 0 with value: 45.319246416315856.
[I 2025-01-31 19:38:00,368] Trial 8 finished with value: 52.53994019436496 and parameters: {'n_estimators': 262, 'max_depth': 9, 'min_samples_split': 18}. Best is trial 0 with value: 45.319246416315856.
[I 2025-01-31 19:38:36,113] Trial 9 finished with value: 48.729840833411615 and parameters: {'n_estimators': 283, 'max_depth': 9, 'min_samples_split': 12}. Best is trial 0 with value: 45.319246416315856.
[I 2025-01-31 19:39:38,098] Trial 10 finished with value: 47.77079215262186 and parameters: {'n_estimators': 483, 'max_depth': 15, 'min_samples_split': 6}. Best is trial 0 with value: 45.319246416315856.
[I 2025-01-31 19:40:41,610] Trial 11 finished with value: 50.370689466852156 and parameters: {'n_estimators': 496, 'max_depth': 15, 'min_samples_split': 6}. Best is trial 0 with value: 45.319246416315856.
[I 2025-01-31 19:41:32,255] Trial 12 finished with value: 50.75912630652019 and parameters: {'n_estimators': 394, 'max_depth': 14, 'min_samples_split': 7}. Best is trial 0 with value: 45.319246416315856.
[I 2025-01-31 19:42:24,626] Trial 13 finished with value: 50.451326542297636 and parameters: {'n_estimators': 377, 'max_depth': 13, 'min_samples_split': 2}. Best is trial 0 with value: 45.319246416315856.
[I 2025-01-31 19:43:28,281] Trial 14 finished with value: 44.400928604553584 and parameters: {'n_estimators': 498, 'max_depth': 16, 'min_samples_split': 6}. Best is trial 14 with value: 44.400928604553584.
[I 2025-01-31 19:44:22,789] Trial 15 finished with value: 50.01024755977366 and parameters: {'n_estimators': 434, 'max_depth': 17, 'min_samples_split': 9}. Best is trial 14 with value: 44.400928604553584.
[I 2025-01-31 19:45:07,195] Trial 16 finished with value: 50.34123853866469 and parameters: {'n_estimators': 353, 'max_depth': 5, 'min_samples_split': 5}. Best is trial 14 with value: 44.400928604553584.
[I 2025-01-31 19:45:37,985] Trial 17 finished with value: 56.24641122467117 and parameters: {'n_estimators': 232, 'max_depth': 12, 'min_samples_split': 8}. Best is trial 14 with value: 44.400928604553584.
[I 2025-01-31 19:45:54,371] Trial 18 finished with value: 54.90330015307118 and parameters: {'n_estimators': 114, 'max_depth': 7, 'min_samples_split': 11}. Best is trial 14 with value: 44.400928604553584.
[I 2025-01-31 19:46:46,522] Trial 19 finished with value: 46.453461597419654 and parameters: {'n_estimators': 443, 'max_depth': 17, 'min_samples_split': 20}. Best is trial 14 with value: 44.400928604553584.
[I 2025-01-31 19:47:06,811] Trial 20 finished with value: 54.093064159162466 and parameters: {'n_estimators': 149, 'max_depth': 7, 'min_samples_split': 11}. Best is trial 14 with value: 44.400928604553584.
[I 2025-01-31 19:48:00,473] Trial 21 finished with value: 53.26261270821192 and parameters: {'n_estimators': 450, 'max_depth': 17, 'min_samples_split': 15}. Best is trial 14 with value: 44.400928604553584.
[I 2025-01-31 19:48:51,157] Trial 22 finished with value: 51.9792077213812 and parameters: {'n_estimators': 427, 'max_depth': 18, 'min_samples_split': 20}. Best is trial 14 with value: 44.400928604553584.
[I 2025-01-31 19:49:46,746] Trial 23 finished with value: 42.92074802256555 and parameters: {'n_estimators': 469, 'max_depth': 15, 'min_samples_split': 17}. Best is trial 23 with value: 42.92074802256555.
[I 2025-01-31 19:50:45,537] Trial 24 finished with value: 48.900586486861485 and parameters: {'n_estimators': 500, 'max_depth': 15, 'min_samples_split': 18}. Best is trial 23 with value: 42.92074802256555.
[I 2025-01-31 19:51:45,658] Trial 25 finished with value: 43.90618505844564 and parameters: {'n_estimators': 472, 'max_depth': 13, 'min_samples_split': 7}. Best is trial 23 with value: 42.92074802256555.
[I 2025-01-31 19:52:46,263] Trial 26 finished with value: 49.960096869274665 and parameters: {'n_estimators': 469, 'max_depth': 13, 'min_samples_split': 5}. Best is trial 23 with value: 42.92074802256555.
[I 2025-01-31 19:53:34,408] Trial 27 finished with value: 40.87329706108914 and parameters: {'n_estimators': 405, 'max_depth': 14, 'min_samples_split': 17}. Best is trial 27 with value: 40.87329706108914.
[I 2025-01-31 19:54:23,222] Trial 28 finished with value: 45.33836409561087 and parameters: {'n_estimators': 412, 'max_depth': 13, 'min_samples_split': 17}. Best is trial 27 with value: 40.87329706108914.
[I 2025-01-31 19:55:08,180] Trial 29 finished with value: 51.77512541922533 and parameters: {'n_estimators': 373, 'max_depth': 11, 'min_samples_split': 16}. Best is trial 27 with value: 40.87329706108914.
[I 2025-01-31 19:55:48,053] Trial 30 finished with value: 49.5890122868372 and parameters: {'n_estimators': 323, 'max_depth': 14, 'min_samples_split': 14}. Best is trial 27 with value: 40.87329706108914.
[I 2025-01-31 19:56:43,155] Trial 31 finished with value: 56.31200560871856 and parameters: {'n_estimators': 467, 'max_depth': 16, 'min_samples_split': 18}. Best is trial 27 with value: 40.87329706108914.
[I 2025-01-31 19:57:42,963] Trial 32 finished with value: 55.21367812795128 and parameters: {'n_estimators': 474, 'max_depth': 19, 'min_samples_split': 8}. Best is trial 27 with value: 40.87329706108914.
[I 2025-01-31 19:58:34,604] Trial 33 finished with value: 47.93501193295199 and parameters: {'n_estimators': 413, 'max_depth': 16, 'min_samples_split': 10}. Best is trial 27 with value: 40.87329706108914.
[I 2025-01-31 19:59:30,294] Trial 34 finished with value: 48.94108389351979 and parameters: {'n_estimators': 461, 'max_depth': 12, 'min_samples_split': 13}. Best is trial 27 with value: 40.87329706108914.
[I 2025-01-31 20:00:28,852] Trial 35 finished with value: 51.90161020248667 and parameters: {'n_estimators': 499, 'max_depth': 14, 'min_samples_split': 19}. Best is trial 27 with value: 40.87329706108914.
[I 2025-01-31 20:01:15,368] Trial 36 finished with value: 52.14052807431667 and parameters: {'n_estimators': 385, 'max_depth': 16, 'min_samples_split': 16}. Best is trial 27 with value: 40.87329706108914.
[I 2025-01-31 20:02:11,833] Trial 37 finished with value: 50.27940615563388 and parameters: {'n_estimators': 419, 'max_depth': 18, 'min_samples_split': 3}. Best is trial 27 with value: 40.87329706108914.
[I 2025-01-31 20:03:07,961] Trial 38 finished with value: 52.03621423881775 and parameters: {'n_estimators': 441, 'max_depth': 11, 'min_samples_split': 7}. Best is trial 27 with value: 40.87329706108914.
[I 2025-01-31 20:03:51,279] Trial 39 finished with value: 51.646460044367196 and parameters: {'n_estimators': 356, 'max_depth': 14, 'min_samples_split': 14}. Best is trial 27 with value: 40.87329706108914.
[I 2025-01-31 20:04:48,103] Trial 40 finished with value: 52.83554547648772 and parameters: {'n_estimators': 481, 'max_depth': 19, 'min_samples_split': 16}. Best is trial 27 with value: 40.87329706108914.
[I 2025-01-31 20:05:29,840] Trial 41 finished with value: 42.661174454529046 and parameters: {'n_estimators': 324, 'max_depth': 9, 'min_samples_split': 8}. Best is trial 27 with value: 40.87329706108914.
[I 2025-01-31 20:06:10,404] Trial 42 finished with value: 46.78674311835803 and parameters: {'n_estimators': 310, 'max_depth': 9, 'min_samples_split': 7}. Best is trial 27 with value: 40.87329706108914.
[I 2025-01-31 20:06:48,438] Trial 43 finished with value: 50.7267284196304 and parameters: {'n_estimators': 285, 'max_depth': 10, 'min_samples_split': 5}. Best is trial 27 with value: 40.87329706108914.
[I 2025-01-31 20:07:38,643] Trial 44 finished with value: 50.008848642671744 and parameters: {'n_estimators': 403, 'max_depth': 8, 'min_samples_split': 10}. Best is trial 27 with value: 40.87329706108914.
[I 2025-01-31 20:08:10,836] Trial 45 finished with value: 50.841108581754824 and parameters: {'n_estimators': 249, 'max_depth': 5, 'min_samples_split': 6}. Best is trial 27 with value: 40.87329706108914.
[I 2025-01-31 20:09:10,737] Trial 46 finished with value: 52.55569086378218 and parameters: {'n_estimators': 484, 'max_depth': 12, 'min_samples_split': 10}. Best is trial 27 with value: 40.87329706108914.
[I 2025-01-31 20:10:08,566] Trial 47 finished with value: 43.054777010174405 and parameters: {'n_estimators': 458, 'max_depth': 15, 'min_samples_split': 8}. Best is trial 27 with value: 40.87329706108914.
[I 2025-01-31 20:10:52,747] Trial 48 finished with value: 50.07590424842294 and parameters: {'n_estimators': 349, 'max_depth': 15, 'min_samples_split': 9}. Best is trial 27 with value: 40.87329706108914.
[I 2025-01-31 20:11:45,537] Trial 49 finished with value: 50.86729800373635 and parameters: {'n_estimators': 431, 'max_depth': 13, 'min_samples_split': 12}. Best is trial 27 with value: 40.87329706108914.
SHAP summary plot saved to Figs/SHAPsum_ElasticNet_False.png

Predict vs. Reality:
Initialized tuner for RandomForestRegressor. Running optimization...
Best parameters for RandomForestRegressor: {'n_estimators': 405, 'max_depth': 14, 'min_samples_split': 17}
Best MAPE for RandomForestRegressor: 40.87329706108914
Results for RandomForestRegressor: R2 = 0.1669749689062282, MSE = 0.12292148815206118, MAE = 0.26226229791596517, MAPE = 13.104111939929378%

Bar Plot for Feature Importance:
  0%|          | 0/3 [00:00<?, ?it/s] 67%|██████▋   | 2/3 [00:00<00:00, 11.60it/s]100%|██████████| 3/3 [00:00<00:00, 11.16it/s]

Generating SHAP Summary Plot...
  0%|          | 0/3 [00:00<?, ?it/s] 67%|██████▋   | 2/3 [00:00<00:00, 11.30it/s]100%|██████████| 3/3 [00:00<00:00, 10.99it/s]
[I 2025-01-31 20:12:03,957] A new study created in memory with name: no-name-1a2f798a-592a-4581-87bb-2f8690bfd1fc
[I 2025-01-31 20:12:14,014] Trial 0 finished with value: 37.55264877095719 and parameters: {'max_depth': 11, 'learning_rate': 5.942796215967056e-05, 'min_samples_split': 37}. Best is trial 0 with value: 37.55264877095719.
[I 2025-01-31 20:12:26,508] Trial 1 finished with value: 45.044934241148596 and parameters: {'max_depth': 11, 'learning_rate': 0.0015782994131085183, 'min_samples_split': 5}. Best is trial 0 with value: 37.55264877095719.
[I 2025-01-31 20:12:37,664] Trial 2 finished with value: 40.19623865654797 and parameters: {'max_depth': 6, 'learning_rate': 0.00011281929385775657, 'min_samples_split': 10}. Best is trial 0 with value: 37.55264877095719.
[I 2025-01-31 20:12:50,906] Trial 3 finished with value: 45.42058036954947 and parameters: {'max_depth': 18, 'learning_rate': 0.1643072437258176, 'min_samples_split': 33}. Best is trial 0 with value: 37.55264877095719.
[I 2025-01-31 20:13:02,881] Trial 4 finished with value: 45.484574273734395 and parameters: {'max_depth': 9, 'learning_rate': 0.0026929675845491175, 'min_samples_split': 8}. Best is trial 0 with value: 37.55264877095719.
